-- --------------------------------------------------------
-- Host:                         127.0.0.1
-- Versión del servidor:         11.8.3-MariaDB - mariadb.org binary distribution
-- SO del servidor:              Win64
-- HeidiSQL Versión:             12.11.0.7065
-- --------------------------------------------------------

/*!40101 SET @OLD_CHARACTER_SET_CLIENT=@@CHARACTER_SET_CLIENT */;
/*!40101 SET NAMES utf8 */;
/*!50503 SET NAMES utf8mb4 */;
/*!40103 SET @OLD_TIME_ZONE=@@TIME_ZONE */;
/*!40103 SET TIME_ZONE='+00:00' */;
/*!40014 SET @OLD_FOREIGN_KEY_CHECKS=@@FOREIGN_KEY_CHECKS, FOREIGN_KEY_CHECKS=0 */;
/*!40101 SET @OLD_SQL_MODE=@@SQL_MODE, SQL_MODE='NO_AUTO_VALUE_ON_ZERO' */;
/*!40111 SET @OLD_SQL_NOTES=@@SQL_NOTES, SQL_NOTES=0 */;


-- Volcando estructura de base de datos para bd_rpm1
CREATE DATABASE IF NOT EXISTS `bd_rpm1` /*!40100 DEFAULT CHARACTER SET utf8mb4 COLLATE utf8mb4_general_ci */;
USE `bd_rpm1`;

-- Volcando estructura para tabla bd_rpm1.entrada
CREATE TABLE IF NOT EXISTS `entrada` (
  `ent_id` int(20) NOT NULL AUTO_INCREMENT,
  `ent_nremision` varchar(30) DEFAULT NULL,
  `ent_fecha` date NOT NULL,
  `ent_pro_codigo` varchar(10) DEFAULT NULL,
  `ent_cantidad` int(11) NOT NULL,
  `ent_cantidad1` int(11) NOT NULL,
  `ent_pro_codigo2` varchar(20) DEFAULT NULL,
  `ent_cantidad2` int(11) NOT NULL,
  `ent_obs` varchar(5000) DEFAULT NULL,
  PRIMARY KEY (`ent_id`),
  KEY `ent_pro_codigo` (`ent_pro_codigo`),
  CONSTRAINT `entrada_ibfk_1` FOREIGN KEY (`ent_pro_codigo`) REFERENCES `producto` (`pro_codigo`) ON DELETE CASCADE ON UPDATE CASCADE
) ENGINE=InnoDB AUTO_INCREMENT=1153 DEFAULT CHARSET=utf8mb4 COLLATE=utf8mb4_general_ci;

-- Volcando datos para la tabla bd_rpm1.entrada: ~838 rows (aproximadamente)
INSERT INTO `entrada` (`ent_id`, `ent_nremision`, `ent_fecha`, `ent_pro_codigo`, `ent_cantidad`, `ent_cantidad1`, `ent_pro_codigo2`, `ent_cantidad2`, `ent_obs`) VALUES
	(239, '40039612331', '2024-02-27', '402069', 12750, 25500, '400164', 12750, ''),
	(240, '4039616100', '2024-02-27', '402069', 12750, 25500, '400164', 12750, 'carta 2'),
	(241, '4039633469', '2024-02-27', '402069', 5100, 10200, '400164', 7650, ''),
	(242, '4039634564', '2024-02-28', '402069', 2550, 1938, '400164', 0, 'El material de esta remisión no trae juegos completos.'),
	(243, '4039634570', '2024-02-28', '402069', 12750, 25500, '400164', 12750, ''),
	(244, '4039655205', '2024-02-28', '402069', 10200, 20400, '400164', 10200, ''),
	(245, '4039656879', '2024-02-29', '402069', 2550, 5100, '400164', 2550, ''),
	(246, '4039657649', '2024-02-29', '402069', 12750, 25500, '400164', 12750, ''),
	(249, '4039677633', '2024-03-01', '402069', 12750, 25500, '400164', 12750, ''),
	(250, '4039680871', '2024-03-01', '402069', 12750, 25500, '400164', 12750, ''),
	(251, '4039700725', '2024-03-02', '402069', 12750, 25500, '400164', 12750, ''),
	(252, '4039704458', '2024-03-02', '402069', 12750, 25500, '400164', 12750, ''),
	(253, '4039709020', '2024-03-02', '402069', 12750, 25500, '400164', 12750, ''),
	(254, '4039722429', '2024-03-03', '402069', 12750, 25500, '400164', 12750, ''),
	(255, '4039728407', '2024-03-03', '402069', 25500, 51000, '400164', 25500, ''),
	(256, '4039751525', '2024-03-04', '402069', 12750, 25500, '400164', 12750, ''),
	(258, '4039770289', '2024-03-05', '402069', 12750, 25500, '400164', 12750, ''),
	(259, '4039782143', '2024-03-06', '400349', 10200, 20400, '400166', 0, ''),
	(260, '88', '2024-03-07', '402069', -2282, -4564, '', 0, ''),
	(261, '888', '2024-03-07', '402069', 2282, 4564, '400164', 0, ''),
	(262, '0105', '2024-03-07', '402069', -13772, -22088, '400164', 0, 'DEVOLUCION DE MATERIAL CONFORME DESPLEGADO A APT. RECIBE: DANIELA RETANA'),
	(263, '0106', '2024-03-07', '402069', 0, 0, '400164', -14984, 'DEVOLUCION DE MATERIAL CONFORME A APT. RECIBE DANIELA RETANA.'),
	(264, '4039791155', '2024-03-07', '400349', 10200, 20400, '400166', 24000, ''),
	(265, '4039799245', '2024-03-07', '400349', 30600, 61200, '400166', 36000, ''),
	(266, '4039791155', '2024-03-08', '400349', -10200, -20400, '400166', -20400, '"REVERSA" A DOCUMENTO CON ERROR EN CANTIDAD DE DIVISORES, ES SUSTITUIDA POR REMISIÓN CON NÚMERO DE SAP 4039806395'),
	(267, '4039806395', '2024-03-08', '400349', 10200, 20400, '400166', 21600, ''),
	(268, '4039791155', '2024-03-08', '400349', 0, 0, '400166', -3600, 'COMPLEMENTO REVERSA DE 24000 SE HABÍA CAPTURADO 20400'),
	(269, 'AJ08032024', '2024-03-08', '402069', -610, 1074, '400164', 363, 'AJUSTE POR DIFERENCIAS FINALES CAMPAÑA XX LAGER 20 MEDIAS DEL 27/02/2024 AL 08/03/2024'),
	(270, 'AJUSTE 0803', '2024-03-08', '402069', 610, -1074, '400164', -363, ''),
	(271, 'AJCORRECTO0803', '2024-03-08', '402069', -610, 1074, '400164', 363, ''),
	(272, 'AJUSTE', '2024-03-08', '402069', 610, -1074, '400164', -1073, ''),
	(273, 'AJ', '2024-03-08', '402069', 0, 0, '400164', 710, ''),
	(274, '000041', '2024-03-08', '402069', 610, -1074, '400164', -363, ''),
	(275, '4039808418', '2024-03-08', '400349', 15300, 30600, '400166', 0, ''),
	(276, '4039816842', '2024-03-08', '400349', 30600, 61200, '400166', 28800, ''),
	(277, '4039827771', '2024-03-09', '400349', 15300, 30600, '400166', 18000, ''),
	(278, '4039833483', '2024-03-09', '400349', 15300, 30600, '400166', 14400, ''),
	(279, '4039846808', '2024-03-10', '400349', 15300, 30600, '400166', 18000, ''),
	(280, '4039854113', '2024-03-10', '400349', 15300, 30600, '400166', 14400, ''),
	(281, '4039860971', '2024-03-11', '400349', 15300, 30600, '400166', 18000, ''),
	(282, '4039868814', '2024-03-11', '400349', 15300, 30600, '400166', 14400, ''),
	(283, '4039875850', '2024-03-12', '400349', 15300, 30600, '400166', 18000, ''),
	(284, '4039889356', '2024-03-13', '400349', 15300, 30600, '400166', 14400, ''),
	(285, '4039894630', '2024-03-13', '400349', 15300, 30600, '400166', 18000, ''),
	(286, '4039895159', '2024-03-13', '401742', 1700, 5100, '400166', 0, ''),
	(287, '4039907983', '2024-03-13', '400349', 30600, 61200, '400166', 28800, ''),
	(288, '4039917822', '2024-03-14', '400349', 15300, 30600, '400166', 18000, ''),
	(289, '40399926548', '2024-03-14', '400349', 15300, 30600, '400166', 14400, ''),
	(290, '4039935748', '2024-03-15', '400349', 15300, 30600, '400166', 18000, ''),
	(291, '4039941104', '2024-03-15', '400349', 30600, 61200, '400166', 27000, ''),
	(292, '4039954578', '2024-03-16', '400349', 15300, 30600, '400166', 18000, ''),
	(293, '4039974510', '2024-03-17', '400349', 15300, 30600, '400166', 14850, ''),
	(294, '4039977754', '2024-03-17', '400349', 30600, 61200, '400166', 27000, 'Diusor: 4 de 4950 y 2 de 3600'),
	(295, '4039987368', '2024-03-18', '400349', 15300, 30600, '400166', 14850, ''),
	(296, '4040010459', '2024-03-19', '400349', 10200, 18600, '400166', 9900, ''),
	(297, '4040016979', '2024-03-19', '400349', 10200, 20400, '400166', 12150, '2 divisores de 3600 y 1 de 4950'),
	(298, '4040023522', '2024-03-20', '402069', 12750, 25500, '400164', 12750, ''),
	(299, '4040035925', '2024-03-20', '402069', 15300, 30600, '400164', 15300, ''),
	(300, 'RPM0109', '2024-03-21', '400349', -3932, -7864, '400166', 0, 'DEVOLUCIÓN MERMA IP'),
	(301, 'RPM0110-0111', '2024-03-21', '400349', 0, 0, '400166', -347, 'MERMA DE DIVISORES. REM 110 131 CPK Y REM 111 216 DE ESCOBEDO'),
	(302, 'RPM0113', '2024-03-21', '400349', -8531, -11682, '400166', 0, 'DEVOLUCION A APT'),
	(303, 'RPM0114', '2024-03-21', '400349', 0, 0, '400166', -8299, 'DEVOLUCION A APT'),
	(304, 'AJUSTE CIERRE 20032024', '2024-03-21', '400349', 1525, -530, '400166', 48, ''),
	(305, 'RPM0107', '2024-03-21', '401742', -1010, -3720, '400166', 0, 'DEVOLUCIÓN A APT'),
	(306, '4040047871', '2024-03-21', '402069', 12750, 25500, '400164', 12750, ''),
	(307, '4040054303', '2024-03-21', '402069', 20400, 40800, '400164', 20250, '5 de divisro de 2550 y 2 de 3750'),
	(308, '4040063673', '2024-03-22', '402069', 12750, 25000, '400164', 12750, ''),
	(309, '4040074287', '2024-03-22', '402069', 20400, 40800, '400164', 22500, ''),
	(310, '4040088339', '2024-03-23', '402069', 12750, 25500, '400164', 11550, ''),
	(311, '4040110279', '2024-03-24', '402069', 12750, 25500, '400164', 11250, ''),
	(312, '4040113386', '2024-03-24', '402069', 15300, 30600, '400164', 15000, ''),
	(313, '4040063673', '2024-03-25', '402069', 0, 500, '400164', 0, 'CORRECCION POR ERROR DE CAPTURA DE   PACKING  CON   FOLIO SIGE 308'),
	(314, '4040135033', '2024-03-25', '402069', 20400, 40800, '400164', 18000, ''),
	(315, '4040149114', '2024-03-26', '402069', 12750, 25500, '400164', 11250, ''),
	(316, '4040157742', '2024-03-26', '402069', 25500, 51000, '400164', 22500, ''),
	(317, '4040173706', '2024-03-27', '402069', 12750, 25500, '400164', 11250, ''),
	(318, '4040181677', '2024-03-27', '402069', 15300, 30600, '400164', 18000, ''),
	(320, '4040201272', '2024-03-28', '402069', 15300, 30600, '400164', 15750, ''),
	(321, '4040210797', '2024-03-29', '402069', 12750, 25500, '400164', 11250, ''),
	(322, '4040221026', '2024-03-29', '402069', 15300, 30600, '400164', 13500, ''),
	(324, '4040230511', '2024-03-30', '402069', 15300, 30600, '400164', 13500, ''),
	(325, '4040241635', '2024-03-30', '402069', 15300, 30600, '400164', 15750, ''),
	(326, '4040249836', '2024-03-31', '402069', 15300, 30600, '400164', 11250, ''),
	(335, '4040249836B', '2024-03-31', '402069', 13772, 22088, '400164', 0, 'B SIGE 327 B'),
	(336, '4040260750', '2024-03-31', '402069', 15300, 30600, '400164', 21000, ''),
	(337, '4040272003', '2024-04-01', '402069', 7650, 15300, '400164', 11250, ''),
	(339, '4040276747B', '2024-04-01', '402069', 0, 0, '400164', 4500, ''),
	(340, '', '2024-04-01', '402069', 15300, 30600, '400164', 16050, 'Div: 3 por 2250, 1 por 3750, 1 por 2550, 1 por 3000 SAP pendiente'),
	(341, '4040292949', '2024-04-02', '402069', 3572, 6788, '400164', 3645, ''),
	(342, '4040293428', '2024-04-02', '402069', 12750, 25500, '400164', 11250, ''),
	(344, '', '2024-04-02', '402069', 25500, 51000, '400164', 28500, ''),
	(345, '', '2024-04-02', '401742', 15300, 30600, '400166', 18000, ''),
	(347, '4040324268', '2024-04-03', '402069', 25500, 51000, '400164', 26250, ''),
	(348, '4040324304', '2024-04-03', '401742', 15300, 30600, '400166', 18000, ''),
	(349, '4040348126', '2024-04-04', '402069', 25500, 51000, '400164', 26500, ''),
	(350, '4040369769', '2024-04-05', '402069', 40800, 81600, '400164', 37500, ''),
	(351, '4040348126', '2024-03-31', '402069', 0, 0, '400164', -250, 'ERROR DE CAPTURA'),
	(352, '4040392200', '2024-04-06', '401742', 10200, 20400, '400166', 14400, ''),
	(353, '4040392245', '2024-04-06', '402069', 12750, 25500, '400164', 22500, ''),
	(354, '4040404387', '2024-04-07', '402069', 15300, 30600, '400164', 15000, ''),
	(355, '4040408059', '2024-04-07', '401742', 15300, 30600, '400166', 19051, ''),
	(356, '4040413507', '2024-04-07', '402069', 15300, 30600, '400164', 22500, ''),
	(357, '4040429396', '2024-04-08', '402069', 12750, 25500, '400164', 15000, ''),
	(358, '4040434089 ', '2024-04-08', '402069', 15300, 30600, '400164', 3750, ''),
	(359, '4040434089 B', '2024-04-08', '401742', 15300, 30600, '400166', 18000, ''),
	(360, '4040451647', '2024-04-09', '402069', 15300, 30600, '400164', 0, ''),
	(361, '4040471286', '2024-04-10', '401742', 4410, 8820, '400166', 0, ''),
	(362, '4040486108', '2024-04-11', '400349', 17000, 35700, '400166', 3600, ''),
	(363, '2024/04/11', '2024-04-11', '400349', 10200, 16782, '400166', 10800, ''),
	(364, 'sin sap', '2024-04-12', '400164', 0, 0, '400164', 1000, 'se ingresaron 1000 divisores por ajuste'),
	(365, 'sin sap', '2024-04-12', '402069', 1000, 0, '0', 0, 'se ingresaron 1000 cuerpospor ajuste'),
	(366, 'sin sap', '2024-04-12', '402069', 10000, 0, '0', 0, 'se agregan 10000 cuerpos por ajuste'),
	(367, 'sin sap', '2024-04-12', '400164', 0, 0, '400164', 10000, 'se agregaron 10000 divisores por ajuste'),
	(368, '4040529340', '2024-04-13', '402069', 15300, 30600, '400164', 15750, ''),
	(369, '2020/04/13', '2024-04-13', '402069', 12750, 25500, '400164', 13500, ''),
	(370, '4040549230', '2024-04-14', '402069', 22950, 45900, '400164', 22500, ''),
	(373, '11042024', '2024-04-15', '402069', -3274, -6548, '400164', 0, 'MERMA XX LAGER 20/2'),
	(374, '11042024', '2024-04-15', '401742', -1796, -2389, '400166', 0, 'MERMA GENERICA 20/4   0121'),
	(375, '12042024', '2024-04-15', '402069', 0, 10200, '400164', 0, 'SE REGISTRA SIN SAP PARA AJUSTAR JUEGOS COMPLETOS'),
	(376, '4040575948', '2024-04-15', '402069', 15300, 30600, '400164', 15750, ''),
	(385, '2024/04/19', '2024-04-19', '400349', 15300, 30600, '400166', 14850, ''),
	(386, '2024/04/20', '2024-04-20', '400349', 15300, 30600, '400166', 14850, ''),
	(387, '4040720495', '2024-04-22', '402069', 15300, 30600, '400164', 13500, ''),
	(388, '4040724340', '2024-04-22', '400349', 15300, 30600, '400166', 17100, ''),
	(389, '4040732968', '2024-04-23', '400349', 15300, 30600, '400166', 14850, ''),
	(390, '4040746625', '2024-04-23', '400349', 15300, 30600, '400166', 14850, ''),
	(391, '4040758694', '2024-04-24', '400349', 15300, 30600, '400166', 14850, ''),
	(392, '25042024', '2024-04-25', '402069', 7650, 15300, '400164', 7500, ''),
	(393, '25042024', '2024-04-26', '402069', 0, 0, '400164', 3750, ''),
	(394, '2024/06/18', '2024-06-18', '400349', 5000, 10000, '400166', 4950, ''),
	(396, 's/n', '2024-06-20', '402069', 0, 0, '400164', -9625, ''),
	(397, 's/n', '2024-06-20', '400349', 0, 0, '400166', -1934, ''),
	(398, 's/n', '2024-06-20', '401742', 0, 0, '400166', 540, ''),
	(399, 's/n', '2024-06-20', '400349', -1853, -1788, '400164', 0, ''),
	(400, 's/n', '2024-06-20', '401742', 596, -11, '400166', 0, ''),
	(403, 's/n', '2024-06-20', '402069', -11978, -11800, '400164', 0, ''),
	(407, 's/n', '2024-07-05', '401453', 1700, 3400, '400689', 1605, ''),
	(413, '22/07/24', '2024-07-22', '401742', 15300, 30600, '400166', 15750, 'sin sap'),
	(414, '24/07/24', '2024-07-24', '401742', 15300, 30600, '400166', 22950, ''),
	(415, '25/07/24', '2024-07-25', '401742', 15300, 30600, '400166', 29700, ''),
	(416, '25/07/24', '2024-07-25', '401742', 15300, 30600, '400166', 14850, ''),
	(417, '25/07/24', '2024-07-25', '401742', 15300, 30600, '400166', 29700, ''),
	(418, '25/07/24', '2024-07-25', '401742', 15300, 30600, '400166', 29700, ''),
	(419, '26/07/24', '2024-07-26', '401742', 15300, 30600, '400166', 0, ''),
	(420, '26/07//24', '2024-07-26', '401742', 15300, 30600, '400166', 0, ''),
	(421, '27/07/24', '2024-07-28', '401742', 15300, 30600, '400166', 14850, ''),
	(422, '27/07/24', '2024-07-28', '401742', 15300, 30600, '400166', 14850, ''),
	(423, '29/07/024', '2024-07-29', '401742', 15300, 30600, '400166', 0, ''),
	(424, '4042646929', '2024-07-29', '401742', 15300, 30600, '400166', 14850, ''),
	(425, '4042646959', '2024-07-29', '401742', 15300, 30600, '400166', 14850, ''),
	(426, '31/07/24', '2024-07-31', '401742', 15300, 30600, '400166', 14850, ''),
	(427, '31/07/24', '2024-07-31', '401742', 15300, 30600, '400166', 14850, ''),
	(428, 's/n', '2024-08-01', '401742', 2016, 4032, '400166', 2016, 'se ingresa material por remision cancelada'),
	(429, '40422699294', '2024-08-01', '401742', 30600, 61200, '400166', 29700, ''),
	(430, '4042717499', '2024-08-01', '401742', 30600, 61200, '400166', 29700, ''),
	(431, '4042720101', '2024-08-02', '401742', 15300, 30600, '400166', 14850, ''),
	(432, '4042716715', '2024-08-02', '401742', 15300, 30600, '400166', 14850, ''),
	(433, '03/08/24', '2024-08-03', '401742', 30600, 61200, '400166', 29700, 'alas 13:45 pm. no se ha recibido SAP  autoriza ingresar al SIGE :German Martinez       ( SIGE 433,434,435)'),
	(434, '04/08/24', '2024-08-04', '401742', 15300, 30600, '400166', 14850, 'Autoriza :German Martinez'),
	(435, '04/08/24', '2024-08-04', '401742', 15300, 30600, '400166', 14850, 'Autoriza: German Martinez'),
	(436, '05/08/24', '2024-08-05', '401742', 15300, 30600, '400166', 14850, 'NO ENTREGARON NUMERO DE SAP'),
	(437, '4042777007', '2024-08-05', '401742', 15300, 30600, '400166', 14850, ''),
	(438, 'B1-05082024', '2024-08-05', '401742', 15300, 30600, '400166', 14850, 'Autoriza : German'),
	(439, '4042796143', '2024-08-06', '401742', 30600, 61200, '400166', 29700, ''),
	(440, '4042799942', '2024-08-06', '401742', 15300, 30600, '400166', 14850, ''),
	(441, 'B1-070824A', '2024-08-08', '401742', 30600, 61200, '400166', 29700, 'AUTORIZO GERMAN'),
	(442, '4042837587', '2024-08-08', '401742', 15300, 30600, '400166', 14850, ''),
	(443, 'b1-080824A', '2024-08-09', '401742', 15300, 30600, '400166', 0, ''),
	(444, 'B-1080824B', '2024-08-09', '401742', 15300, 30600, '400166', 29700, ''),
	(445, '4042854242', '2024-08-09', '401742', 15300, 30600, '400166', 14850, ''),
	(446, '4042858542', '2024-08-10', '401742', 30600, 61200, '400166', 29700, ''),
	(447, 'B1-100824', '2024-08-10', '401742', 30600, 61200, '400166', 29700, ''),
	(448, 'B2-110824', '2024-08-11', '401742', 10200, 20400, '400166', 9900, ''),
	(449, 'B1 140824', '2024-08-14', '401742', 15300, 30600, '400166', 14850, 'INGRESO ALAN ESCOBAR  HORA   00:36 '),
	(450, 'A1 140824', '2024-08-14', '401742', 15300, 30600, '400166', 14850, 'ELEAZAR 8:50 '),
	(451, 'B1 140824', '2024-08-14', '401742', 15300, 30600, '400166', 14850, ''),
	(452, 'A1 150824', '2024-08-15', '401742', 15300, 30600, '400166', 14850, 'ELEAZAR 7:58'),
	(453, 'B1 150824', '2024-08-15', '401742', 15300, 30600, '400166', 14850, 'ALAN 20:31'),
	(454, 'A1 160824', '2024-08-16', '401742', 15300, 30600, '400166', 14850, 'ELEAZAR 7:29'),
	(455, 'B1 160824', '2024-08-16', '401742', 10200, 20400, '400166', 9900, 'ALAN 15:48'),
	(456, 'B2 160824', '2024-08-16', '401742', 15300, 30600, '400166', 14850, 'ALAN 21:42'),
	(457, 'A1 170824', '2024-08-17', '401742', 15300, 30600, '400166', 14850, 'ELEAZAR 7:55'),
	(458, 'B1 170824', '2024-08-17', '401742', 15300, 30600, '400166', 14850, 'ALAN 20:24'),
	(459, 'A1 180824', '2024-08-18', '401742', 15300, 30600, '400166', 14850, 'ELEAZAR 6:59'),
	(460, 'A2 180824', '2024-08-18', '401742', 15300, 30600, '401742', 4850, 'ELEAZAR 16:24'),
	(461, 'B1 190824', '2024-08-19', '401742', 15300, 30600, '400166', 14850, 'ALAN 05:02'),
	(462, 'MERMAMIP070824', '2024-08-19', '401742', 5100, 10200, '400166', 730, ''),
	(463, 'MERMAIP120824', '2024-08-19', '401742', 3400, 6800, '400166', 0, ''),
	(464, 'MERMAIP070824REV', '2024-08-19', '401742', -5100, -10200, '400166', -730, 'CORRECCION MOVIMIENTO DE MERMA'),
	(465, 'MERMAIP120824REV', '2024-08-19', '401742', -3400, -6800, '400166', 0, 'CORRECCIÓN REVERSA MERMA'),
	(466, 'MERMAIP 070824 OK', '2024-08-19', '401742', -5100, -10200, '400166', -730, 'MERMA OK 120824'),
	(467, 'MERMAIP120824OK', '2024-08-19', '401742', -3400, -6800, '400166', 0, 'MERMA IP 120824 OK'),
	(468, 'MERMAIP160824OK', '2024-08-19', '401742', -3400, -6800, '400166', -975, 'MERMA IP 160824 OK'),
	(469, 'AJ-A2180824', '2024-08-19', '401742', 0, 0, '400166', 14850, 'CAPTURA ERR{ONEA'),
	(470, 'AJUSTE A2180824DIV', '2024-08-19', '401742', 0, 0, '401742', -4850, ''),
	(471, 'A1 190824', '2024-08-19', '401742', 15300, 30600, '400166', 14850, 'ELEZAR 15:43'),
	(472, 'B1 200824', '2024-08-20', '401742', 15300, 30600, '400166', 14850, 'ALAN 03:11'),
	(473, '4043063843', '2024-08-20', '401742', 15300, 30600, '400166', 14850, 'ELEAZAR 7:46'),
	(474, 'B1 200824', '2024-08-20', '401742', 15300, 30600, '400166', 14850, 'ALAN 18:58'),
	(475, '4043084921', '2024-08-21', '401742', 15300, 30600, '400166', 14850, 'ELEAZAR 7:44'),
	(476, 'A2 210824', '2024-08-21', '401742', 15300, 30600, '400166', 14850, 'ELEAZAR 16:53'),
	(477, 'B1 210824', '2024-08-21', '401742', 15300, 30600, '400166', 14850, 'ALAN 23:47'),
	(478, '4043110008', '2024-08-22', '401742', 15300, 30600, '400166', 14850, 'ELEAZAR 13:09'),
	(479, 'B1 220824', '2024-08-22', '401742', 15300, 30600, '400166', 14850, 'ALAN 22:10'),
	(480, '4043125504', '2024-08-23', '401742', 15300, 30600, '400166', 14850, 'ELEAZAR 7:54'),
	(481, 'MERMAIP230824', '2024-08-23', '401742', -8500, -17000, '400166', 0, ''),
	(482, 'MESCOBEDO230824', '2024-08-23', '401742', 0, 0, '400166', 1015, ''),
	(483, 'MESCOBEDO', '2024-08-23', '401742', 0, 0, '400166', -1015, 'REVERSA'),
	(484, 'MESCOBEDO2308OK', '2024-08-23', '401742', 0, 0, '400166', -1015, ''),
	(485, 'B1230824', '2024-08-23', '401742', 15300, 30600, '400166', 14850, 'ALAN 20:14'),
	(486, '4043141761', '2024-08-24', '401742', 15300, 30600, '400166', 14850, 'ALAN 4:00'),
	(487, 'A1 240824', '2024-08-24', '401742', 15300, 30600, '400166', 14850, 'ELEAZAR 9:40'),
	(488, 'A2 240824', '2024-08-24', '401742', 15300, 30600, '400166', 14850, 'ELEAZAR 16:38'),
	(489, '4043161423', '2024-08-25', '401742', 15300, 30600, '400166', 14850, 'ALAN 5:15'),
	(490, 'A1 250824', '2024-08-25', '401742', 15300, 30600, '400166', 14850, 'ELEAZAR 13;34'),
	(491, '4043177823', '2024-08-25', '401742', 15300, 30600, '400166', 14850, 'ALAN 11:58'),
	(492, 'AI 260824', '2024-08-26', '401742', 29808, 59616, '400166', 29808, 'ELEAZAR 6:27 CORRECCION POR EROR EN REMISION'),
	(493, 'A1 260824', '2024-08-26', '401742', 15300, 30600, '400166', 14850, 'ELEAZAR 16:00'),
	(494, '4043204333', '2024-08-27', '401742', 15300, 30600, '400166', 14850, 'ELEAZAR 9:00'),
	(495, 'A2 270824', '2024-08-27', '401742', 15300, 30600, '400166', 14850, 'ELEAZAR 16:10'),
	(496, '4043217886', '2024-08-27', '401742', 15300, 30600, '400166', 14850, 'ALAN 11:40'),
	(497, 'A1 280824', '2024-08-28', '401742', 15300, 30600, '400166', 14850, 'ELEAZAR 11:50'),
	(498, 'B1 280824', '2024-08-28', '401742', 15300, 30600, '400166', 14850, 'ALAN  19:30'),
	(499, '4043244160', '2024-08-29', '401742', 15300, 30600, '400166', 14850, 'ELEAZAR 8:45 '),
	(500, 'MERMA 260824', '2024-08-29', '401742', -5100, -10200, '400166', 0, 'Merma entregada el 26 de agosto 2024'),
	(501, '4043257310', '2024-08-29', '401742', 5100, 10200, '400166', 4950, 'ALAN 23:45'),
	(502, '4043344496', '2024-09-03', '401742', 15300, 30600, '400166', 14850, 'ELEAZAR 12:15 '),
	(504, '4043346575', '2024-09-03', '401742', 15300, 30600, '400166', 14850, 'ELEAZAR 14:35'),
	(505, '4043359886', '2024-09-04', '401742', 30600, 61200, '400166', 29700, 'ELEAZAR 9:22'),
	(506, 'MERMA300824', '2024-09-04', '401742', -3400, -6800, '400166', 0, 'REPORTE DE MERMA DEL 30 DE AGOSTO'),
	(507, 'MERMADIV300824', '2024-09-04', '401742', 0, 0, '400166', -754, 'MERMA DIVISOR ESCOBEDO 30/08/24'),
	(508, '4043378612', '2024-09-05', '401742', 40800, 81600, '400166', 39600, 'ELEAZAR 9:12'),
	(509, '4043380789', '2024-09-05', '401742', 0, 0, '400166', 683, 'ELEAZAR 12:21'),
	(510, '4043397370', '2024-09-06', '401742', 40800, 81600, '400166', 39600, 'ELEAZAR 8:40'),
	(511, 'MERMA060924', '2024-09-06', '401742', -1700, -3400, '400166', 0, 'REPORTE DE MERMA 05092024'),
	(512, '4043415859', '2024-09-07', '401742', 40800, 81600, '400166', 39600, 'ELEAZAR 9:05'),
	(513, 'A1080924', '2024-09-08', '401742', 15300, 30600, '400166', 29700, 'ELEAZAR 10:59'),
	(514, 'A1080924', '2024-09-08', '400349', 15300, 30600, '400166', 0, 'ELEAZAR 11:00'),
	(515, '4043454338', '2024-09-09', '401742', 20400, 40800, '400166', 24750, 'ELEAZAR 12:39'),
	(517, '4043470578', '2024-09-10', '401742', 20400, 40800, '400166', 44550, 'ELEAZAR 9:41 '),
	(518, '4043470578', '2024-09-10', '400349', 25500, 51000, '400166', 0, 'ELEAZAR 9:43'),
	(519, '4043491457', '2024-09-11', '400349', 15300, 30600, '400166', 0, 'ELEAZAR 12:20'),
	(521, '0131', '2024-09-11', '400349', -17000, -34000, '400166', 0, 'ELEAZAR 12:28'),
	(522, '4043493255', '2024-09-11', '400349', 25500, 51000, '400166', 24750, 'ELEAZAR 5:17'),
	(523, '4043511599', '2024-09-12', '400349', 30600, 61200, '400166', 29700, 'ELEAZAR 13:30'),
	(524, '4043526804', '2024-09-13', '400349', 20400, 40800, '400166', 19800, 'ELEAZAR 12:56'),
	(525, '4043546147', '2024-09-14', '400349', 45900, 91800, '400166', 44550, 'ELEAZAR 11:30'),
	(526, 'A1 150924', '2024-09-15', '400349', 30600, 61200, '400166', 29700, 'ELEAZAR 10:00'),
	(527, 'A1 160924', '2024-09-16', '400349', 30600, 61200, '400166', 29700, 'ELEAZAR 9:31'),
	(528, '4043297781', '2024-09-17', '400349', 30600, 61200, '400166', 29700, 'ELEAZAR 8:30'),
	(529, 'MERMA 130924', '2024-09-18', '400349', -526, -1032, '400166', 0, 'MERMA 13 90 24'),
	(530, 'MERMA130924 COMPLE', '2024-09-18', '400349', 0, -20, '400166', 0, 'CORRECCION'),
	(531, 'MERMA 130924', '2024-09-18', '401742', -2221, -4442, '400166', -775, 'MERMA CUERPO Y TAPA GENERICA Y DIVISOR 130924'),
	(532, '0138', '2024-09-19', '401742', 0, -1906, '400166', 0, 'tapa conforme se regresa a APT'),
	(533, 'MERMA180924', '2024-09-21', '401742', -183, -366, '400166', -340, 'MERMA DE CUERPO TAPA Y DIVISOR CIERRE 180924'),
	(534, '4043676597', '2024-09-23', '400349', 15300, 30600, '400166', 0, 'ELEAZAR 12:30'),
	(535, '4043715379', '2024-09-23', '400349', 30600, 61200, '400166', 29700, 'ELEAZAR 17:15'),
	(536, '4043728925', '2024-09-24', '400349', 25500, 51000, '400166', 24750, 'ELEAZAR 11:40'),
	(537, '4043746415', '2024-09-25', '400349', 13219, 28900, '400166', 14850, 'ELEAZAR 9:25'),
	(538, '4043756480', '2024-09-25', '400349', 10200, 20400, '400166', 9900, 'ALAN 22:03'),
	(539, '4043768805', '2024-09-26', '400349', 30600, 61200, '400166', 29700, 'ELEAZAR 3:25'),
	(540, '4043781669', '2024-09-27', '400349', 30600, 61200, '400166', 27044, 'ELEAZAR 9:00'),
	(541, 'DEVOLUCION180924', '2024-09-27', '400349', -30219, -64150, '400166', 0, 'pARO DE LINEA'),
	(542, 'MERMA 180924', '2024-09-27', '400349', -673, -1346, '400166', 0, ''),
	(543, 'MERMA 190924', '2024-09-27', '400349', 0, 0, '400166', -340, ''),
	(544, 'MERMAM180924REVERSA', '2024-09-27', '400349', 0, 0, '400166', 340, ''),
	(545, '4043804510', '2024-09-28', '400349', 30600, 61200, '400166', 29700, 'ELEAZAR 2:47'),
	(546, '4043822580', '2024-09-29', '400349', 52700, 104950, '400166', 49500, 'ELEAZAR 13:50'),
	(547, 'MERMA300924-141', '2024-09-30', '400349', -1700, -3400, '400166', 0, ''),
	(548, '4043383932', '2024-09-30', '400349', 20400, 40800, '400166', 19800, 'ELEAZAR 13:25'),
	(549, '4043858515', '2024-10-01', '400349', 30600, 61200, '400166', 29700, 'ELEAZAR 14:45'),
	(550, '4043875668', '2024-10-02', '400349', 35700, 71400, '400166', 34650, 'ELEAZAR 12:25'),
	(551, '4043890574', '2024-10-03', '400349', 35700, 71400, '400166', 24750, 'ELEAZAR 11:17'),
	(552, '4043907991', '2024-10-04', '400349', 45900, 91800, '400166', 44550, 'ELEAZAR 9:10'),
	(553, 'A1 051024', '2024-10-05', '400349', 45900, 91800, '400166', 44550, 'ELEAZAR 13:40'),
	(554, '4043947762', '2024-10-06', '400349', 5100, 10200, '400166', 9900, 'ELEAZAR 13:35'),
	(555, '4043961370', '2024-10-07', '401742', 20400, 40800, '400166', 14850, 'ELEAZAR 13:22'),
	(556, '0145', '2024-10-07', '400349', -3463, -9814, '400166', 0, 'MATERIALES CONFORME'),
	(557, '0144', '2024-10-07', '400349', -5368, -10736, '400166', -941, 'MERMA XX 20/4 Y DIVISOR 20/4'),
	(558, '4043752881', '2024-10-10', '401742', 10200, 20400, '400166', 9900, 'ALAN 07:55'),
	(565, '4044146858', '2024-10-17', '400349', 15300, 30600, '400166', 14850, 'ELEAZAR 17:30'),
	(566, '4044150372', '2024-10-18', '400349', 30600, 61200, '400166', 29700, 'ELEAZAR 14:40'),
	(567, 'A1181024', '2024-10-18', '400349', -1876, 836, '400166', -242, 'AJUSTE A CERO DE MATERIALES XX 20/4'),
	(568, 'A1191024', '2024-10-19', '400349', 45900, 91800, '400166', 44550, 'ELEAZAR'),
	(569, 'A1201024', '2024-10-20', '400349', 45900, 91800, '400166', 44550, 'ELEAZAR 11:10'),
	(570, '4044211071', '2024-10-22', '400349', 30600, 61200, '400166', 29700, 'ELEAZAR 8:55'),
	(571, '4044227931', '2024-10-23', '400349', 40800, 81600, '400166', 39600, 'ELEAZAR 10:10'),
	(572, '4044241682', '2024-10-24', '400349', 40800, 81600, '400166', 39815, 'ELEAZAR 11:30'),
	(573, '4044257230', '2024-10-25', '400349', 40800, 81600, '400166', 39600, 'ELEAZAR 10:19'),
	(574, '4044276165', '2024-10-26', '400349', 40800, 81600, '400166', 39600, 'ELEAZAR :14:55'),
	(575, '4044290940', '2024-10-27', '400349', 40800, 81600, '400166', 39600, 'ELEAZAR 12:04'),
	(576, '4044309070', '2024-10-28', '400349', 30600, 61200, '400166', 29700, 'ELEAZAR 14:42'),
	(577, '4044322551', '2024-10-29', '400349', 30600, 61200, '400166', 29700, 'ELEAZAR 16:10'),
	(578, '4044341291', '2024-10-30', '400349', 30600, 61200, '400166', 29700, 'ELEAZAR 11:20'),
	(579, '0153', '2024-10-31', '400349', -1700, -3400, '400166', 0, 'DEVOLUCION DE MERMA'),
	(580, '4044359099', '2024-10-31', '400349', 45900, 91800, '400166', 44550, 'ELEAZAR 11:16'),
	(581, '4044379075', '2024-11-01', '400349', 20400, 40800, '400166', 19800, 'ELEAZAR 14:47'),
	(582, '0155', '2024-11-01', '400349', -3400, -6800, '400166', 0, 'DEVOLUCION DE MERMA IP'),
	(583, '4044396140', '2024-11-02', '400349', 35700, 71400, '400166', 34650, 'ELEAZAR 15:50'),
	(584, '4044413286', '2024-11-03', '400349', 30600, 61200, '400166', 29700, 'ELEAZAR 11:55'),
	(585, '4044429160', '2024-11-04', '400349', 15300, 30600, '400166', 19800, 'ELEAZAR 13:48'),
	(586, '4044443898', '2024-11-05', '400349', 30600, 61200, '400166', 29700, 'ALAN 11:15'),
	(587, '4044459515', '2024-11-06', '400349', 45900, 91800, '400166', 49500, 'ELEAZAR 10:45'),
	(588, 'REV1441', '2024-11-07', '400349', -3312, -6624, '400166', -3312, 'Reversa para anular el movimiento 1441 que no se imprimió'),
	(589, 'REV1441', '2024-11-07', '400349', 6624, 13248, '400166', 6624, ''),
	(590, '4044475679', '2024-11-07', '400349', 30600, 61200, '400166', 29700, 'ELEAZAR 15:00'),
	(591, '4044493337', '2024-11-08', '400349', 45900, 91800, '400166', 49500, 'ELEAZAR 11:00'),
	(592, '4044813443', '2024-11-09', '400349', 45900, 91800, '400166', 46800, 'ELEAZAR 11:30'),
	(593, '4044547253', '2024-11-11', '400349', 15363, 30214, '400166', 10800, 'ELEAZAR 11:30'),
	(594, '4044565221', '2024-11-12', '400349', 20400, 40800, '400166', 21600, 'ELEAZAR 10:15'),
	(595, '4044587992', '2024-11-13', '400349', 30600, 61200, '400166', 31500, 'ELEAZAR 14:59'),
	(596, '0156', '2024-11-13', '400349', -1700, -3400, '400166', -1425, 'DEVOLUCION DE MERMA'),
	(597, '4044604014', '2024-11-14', '400349', 40800, 81600, '400166', 39600, 'ELEAZAR 14:20'),
	(598, '4044617502', '2024-11-15', '400349', 25500, 51000, '400166', 24750, 'ELEAZAR 10:35'),
	(599, '4044638600', '2024-11-16', '400349', 51000, 102000, '400166', 49500, 'ELEAZAR 14:10'),
	(600, '4044669714', '2024-11-18', '400349', 20400, 40800, '400166', 19800, 'ELEAZAR'),
	(601, '4044689278', '2024-11-19', '400349', 40800, 81600, '400166', 39993, 'ELEAZAR 12:05'),
	(602, '0157 /  0158', '2024-11-19', '400349', -5285, -10570, '400166', 0, 'ELEAZAR 12:10'),
	(603, '4044705527', '2024-11-20', '400349', 40800, 81600, '400166', 39600, 'ELEAZAR 13:40'),
	(604, '4044723953', '2024-11-21', '400349', 30600, 61200, '400166', 28800, 'ELEAZAR 11:20'),
	(605, '4044740116', '2024-11-22', '400349', 47600, 102000, '400166', 34650, 'ELEAZAR 12:05'),
	(606, '4044831049', '2024-11-27', '400349', 0, 0, '400166', 14850, 'ELEAZAR 11:40'),
	(607, '0160', '2024-12-02', '400349', 0, -22713, '400166', -7063, 'devolucion materiales conforme'),
	(608, '0161', '2024-12-02', '400349', -2307, -4614, '400166', -681, 'devolucion de merma'),
	(609, '14/12/24 A', '2024-12-14', '401742', 15300, 30600, '400166', 14850, 'FRANK 13:23pm'),
	(610, '4045142468', '2024-12-14', '401742', 15300, 30600, '400166', 14850, ''),
	(611, '4045175630', '2024-12-16', '401742', 15300, 30600, '400166', 14850, 'FRANK 11:02 AM'),
	(612, 'Sin documento 16/12/24', '2024-12-16', '401742', 15300, 30600, '400166', 14850, 'NO SE ENTREGO REMISION '),
	(613, '4045193053', '2024-12-17', '401742', 15300, 30600, '400166', 14850, ''),
	(614, '4045198657', '2024-12-17', '401742', 15300, 30600, '400166', 14850, 'FRANK 15:57PM'),
	(615, '4045217722', '2024-12-18', '401742', 15300, 30600, '400166', 14850, ''),
	(616, '4045218149', '2024-12-18', '401742', 10200, 20400, '400166', 0, 'MATERIAL RECHAZADO PARA PRUEBA 14:47PM'),
	(617, '0162', '2024-12-19', '401742', -10200, -20400, '400166', 0, 'DEVOLUCION MATERIAL RECHAZADO PARA PRUEBAS IP '),
	(618, '4045234958', '2024-12-19', '401742', 15300, 30600, '400166', 14850, 'FRANK 1517PM'),
	(619, '4045234399', '2024-12-19', '401742', 15300, 30600, '400166', 14850, ''),
	(620, '4045255374', '2024-12-20', '401742', 30600, 61200, '400166', 29700, 'FRANK 14:40PM'),
	(621, '4045180955', '2024-12-20', '401742', 15300, 30600, '400166', 14850, 'FRANK 17:23PM'),
	(622, '4045274783', '2024-12-21', '401742', 30600, 61200, '400166', 29700, 'FRANK 16:02PM'),
	(623, 'SIN DOCUMENTO POR APT', '2024-12-22', '401742', 30600, 61200, '400166', 29700, 'NO SE RECIBIO REMISION POR PARTE DE APT.    FRANK 20:00'),
	(624, '4045310832', '2024-12-23', '401742', 30600, 61200, '400166', 24750, 'FRANK 15:10PM'),
	(625, '4045320640', '2024-12-23', '401742', 15300, 30600, '400166', 14850, 'ALAN 21:40'),
	(626, '4045331812', '2024-12-24', '401742', 30600, 61200, '400166', 29700, 'FRANK 17:37PM'),
	(627, '4045352983', '2024-12-25', '401742', 30600, 61200, '400166', 29700, 'FRANK 14:30'),
	(628, '0163', '2024-12-26', '401742', -14886, -29772, '400166', 0, 'DEVOLUCION DE MATERIAL RECHAZADO POR PERSONAL IP TRASPASO '),
	(629, '0164', '2024-12-26', '401742', -3400, -6800, '400166', 0, 'DEVOLUCION DE MERMA IP.'),
	(630, 'AJUSTE CAMPAÑA OCTUBRE ', '2024-12-26', '401742', -3985, -6064, '400166', 5865, ''),
	(631, '4045362985', '2024-12-27', '401742', 15300, 30600, '400166', 16963, 'FRANK 13:00PM'),
	(632, '4045376439', '2024-12-28', '401742', 30600, 61200, '400166', 29700, 'FRANK 12:22PM'),
	(633, '4045310666', '2024-12-29', '401742', 30600, 61200, '400166', 19800, 'FRANK 17:00PM'),
	(634, '4045403421', '2024-12-30', '401742', 15300, 30600, '400166', 18000, 'FRANK 17:00'),
	(635, '30122024', '2024-12-30', '401742', 25500, 51000, '400166', 36000, 'SIN DOCUMENTO POR AUSENCIA DE ANDREA'),
	(636, '0165', '2024-12-31', '401742', -976, -1952, '400166', 0, 'DEVOLUCION MERMA IP'),
	(637, '0166', '2024-12-31', '401742', -1700, -3400, '400166', 0, 'DEVOLUCION MERMA IP'),
	(638, '0167', '2024-12-31', '401742', 0, 0, '400166', -894, 'DEVOLUCION MERMA ESCOBEDO '),
	(639, '0168', '2024-12-31', '401742', -139, -278, '400166', 0, 'MATERIAL RECHAZADO POR IP CAJA ARMADA'),
	(640, '4045416544', '2024-12-31', '401742', 30600, 61200, '400166', 36000, 'FRANK 17:26PM'),
	(641, '4045433771', '2025-01-02', '401742', 15300, 30600, '400166', 18000, 'FRANK 14:00PM'),
	(642, '4045451355', '2025-01-03', '401742', 30600, 61200, '400166', 36000, 'FRANK 18:00PM'),
	(643, '4045469293', '2025-01-04', '401742', 25500, 51000, '400166', 14400, 'ELEAZAR 13:15 '),
	(644, '4045485742', '2025-01-05', '401742', 20400, 40800, '400166', 28800, 'ELEAZAR 10:55'),
	(645, '0169', '2025-01-06', '401742', -1700, -3400, '400166', 0, 'MERMA IP'),
	(646, '4045509095', '2025-01-06', '401742', 25500, 51000, '400166', 14400, 'ELEAZAR 14:59'),
	(647, '08/01/05', '2025-01-08', '401742', 30600, 61200, '40166', 0, 'MATERIAL SIN DOCUMENTO'),
	(648, '08012025', '2025-01-08', '401742', 1052, 2104, '400166', 1052, 'AJUSTE REMISION 1775'),
	(649, '4045551416', '2025-01-08', '401742', 35700, 71400, '400166', 54000, 'ELEAZAR 16:25'),
	(650, '4045568033', '2025-01-09', '401742', 20400, 40800, '400166', 25200, 'ELEAZAR 15:05'),
	(651, '4045647657', '2025-01-13', '400349', 15300, 30600, '400166', 0, 'FRANK 17:20PM'),
	(652, '4045660376', '2025-01-14', '400349', 15300, 30600, '400166', 21600, 'ELEAZAR 12:54'),
	(653, '40415660519', '2025-01-14', '401742', 14886, 29772, '400166', 0, 'ELEAZAR 12:58 MATERIALES VALIDA  IP'),
	(654, '001795', '2025-01-16', '401742', -3519, -7038, '400166', -3519, 'CORRECCION DE FOLIO 1795'),
	(655, '001795', '2025-01-16', '401742', 7038, 14076, '400166', 7038, 'ENTRADA POSITIVA'),
	(656, '16/01/25', '2025-01-16', '400349', -8817, -1209, '400166', 0, 'AJUSTE CAMPAÑA PREVIA ENERO 2025'),
	(657, '4045704230', '2025-01-16', '400349', 15300, 30600, '400166', 33066, 'frank 15:45pm'),
	(658, '0173', '2025-01-17', '401742', -1573, -3146, '400166', 0, 'MERMA GENERICA PROVEEDOR IP'),
	(659, '0172', '2025-01-17', '401742', -13, -26, '400166', 0, 'CAJA ARMADA RECHAZADA POR IP'),
	(660, '0171', '2025-01-17', '401742', -3299, -6598, '400166', 0, 'MATERIALES RECHAZADOS POR IP DEVOLUCION A APT'),
	(661, '4045777937', '2025-01-20', '401742', 30600, 61200, '400166', 36000, 'ELEAZAR 14:50 MATERIALES CONFORME'),
	(662, '4045794142', '2025-01-21', '401742', 30600, 61200, '400166', 36000, 'ELEAZAR 11:06'),
	(663, '0175', '2025-01-22', '401742', -6295, -12590, '400166', 0, 'MATERIAL RETENIDO DEVUELTO A APT'),
	(664, '0174', '2025-01-22', '400349', -304, -608, '400166', 0, 'MERMA XX LAGER '),
	(665, '4045814784', '2025-01-22', '401742', 30600, 61200, '400166', 10800, 'ELEAZAR 11:45'),
	(666, '22/01/2025', '2025-01-22', '400349', 53, 106, '400166', 0, 'AJUSTE POR CIERRE DE REEMPACADO '),
	(667, '23/01/25', '2025-01-23', '401453', -810, 0, '400689', -310, 'AJUSTE A CERO'),
	(668, '23/01/25', '2025-01-23', '401453', 450, -810, '400689', 0, 'AJUSTE'),
	(669, '23/01/25', '2025-01-23', '401453', -45, 0, '400689', 0, 'AJUSTE'),
	(671, '23/01/25', '2025-01-23', '401742', 0, 0, '400166', 10800, 'AJUSTE DE ENTRADA SIGE 665 , NO INGRESO EL DIVISOR SIGE'),
	(672, '4045834123', '2025-01-23', '401742', 30600, 61200, '400166', 32400, 'ELEAZAR 15:30'),
	(673, '4045847340', '2025-01-24', '401742', 30600, 61200, '400166', 32400, 'ELEAZAR 10:05'),
	(674, '0176', '2025-01-24', '401742', -1700, -3400, '400166', 0, 'MERMA GENERICA 20/4  '),
	(675, '4045871560', '2025-01-25', '401742', 30600, 61200, '400166', 32400, 'ELEAZAR 15:00'),
	(676, '4045889893', '2025-01-26', '401742', 30600, 61200, '400166', 32400, 'FRANK 13:23 PM'),
	(677, '4045907546', '2025-01-27', '401742', 30600, 61200, '400166', 32400, 'FRANK 14:50PM'),
	(678, '4045928074', '2025-01-28', '401742', 30600, 61200, '400166', 32400, 'FRANK 12:50PM'),
	(679, '4045965514', '2025-01-30', '401742', 30600, 61200, '400166', 32400, 'ELEAZAR 11:25'),
	(680, '0177', '2025-01-31', '401742', -1700, -3400, '400166', 0, 'MERMA GENERICA 20/4'),
	(681, '4045987974', '2025-01-31', '401742', 30600, 61200, '400166', 32400, 'ELEAZAR 13:57'),
	(682, '01/02/2025', '2025-02-01', '401742', 30600, 61200, '400166', 32400, 'ELEAZAR 12:38'),
	(683, '02/02/2025', '2025-02-02', '401742', 30600, 61200, '400166', 32400, 'ELEAZAR 1045'),
	(684, '4045987974', '2025-02-03', '401742', 29356, 61200, '400166', 32400, 'ELEAZAR 14:55'),
	(685, '4045063417', '2025-02-04', '401742', 30600, 61200, '400166', 36000, 'ELEAZAR 14:42'),
	(686, '05/02/2025', '2025-02-05', '401742', 256, 512, '400166', 256, 'ELEAZAR 6:50 '),
	(687, '4046080253', '2025-02-05', '401742', 30600, 61200, '400166', 32400, 'FRAN 15:31PM '),
	(688, '0180', '2025-02-06', '401742', -1700, -3400, '400166', 0, 'MERMA GEN. 20/4'),
	(689, '4046100264', '2025-02-06', '401742', 30600, 61200, '400166', 32400, 'ELEAZAR 12:15'),
	(690, '4046118464', '2025-02-07', '401742', 61200, 122400, '400166', 43200, 'ELEAZAR 9:23'),
	(691, '08/02/2025', '2025-02-08', '401742', 45900, 91800, '400166', 43200, 'ELEAZAR 13:55'),
	(692, '4046158087', '2025-02-09', '401742', 45900, 91800, '400166', 43200, 'ELEAZAR 12:15'),
	(693, '4046174602', '2025-02-10', '401742', 16276, 32552, '400166', 14400, 'ELEAZAR 10:41'),
	(694, '4046192732', '2025-02-11', '401742', 30600, 61200, '400166', 32400, 'ELEAZAR 11:34'),
	(695, '4046214405', '2025-02-12', '401742', 15300, 30600, '400166', 10800, 'ELEAZAR 16:54'),
	(696, '4046225894', '2025-02-13', '401742', 30600, 61200, '400166', 32400, 'FRANK 14:50PM'),
	(697, '4046243791', '2025-02-14', '401742', 20400, 40800, '400166', 21600, 'ELEAZAR 13:48'),
	(698, '4046262791', '2025-02-15', '401742', 45900, 91800, '400166', 43200, 'ELEAZAR 10:55'),
	(699, '0181', '2025-02-15', '401742', -1700, -3400, '40166', 0, 'MERMA GENERICA'),
	(700, '4046299147', '2025-02-17', '401742', 30600, 61200, '400166', 28800, 'ELEAZAR 11:25'),
	(701, '4046978194', '2025-02-21', '400734', 13600, 27200, '400689', 15750, 'ELEAZAR 13:11'),
	(702, '4046421433', '2025-02-24', '400734', 10200, 20400, '400689', 10500, 'ELEAZAR 16:19'),
	(703, '4046432626', '2025-02-25', '400734', 17000, 34000, '400689', 21000, 'ELEAZAR 14:58'),
	(704, '4046447661', '2025-02-26', '400734', 17000, 34000, '400689', 18375, 'ELEAZAR 9:37'),
	(705, '4046448911', '2025-02-26', '401742', 15300, 30600, '400166', 14400, 'ELEAZAR 10:30'),
	(706, '4046462885', '2025-02-27', '400734', 17000, 34000, '400689', 18375, 'ELEAZAR 9:15'),
	(707, '4046477662', '2025-02-28', '400734', 17000, 34000, '400689', 10500, 'ELEAZAR 12:28'),
	(708, '002108', '2025-03-01', '401742', 1440, 2880, '400166', 1440, 'CORRECION DE REMISION  FOLIO 2108'),
	(709, '4046495343', '2025-03-01', '401742', 15300, 30600, '400166', 18000, 'ELEAZAR 13.45'),
	(710, '4046495316', '2025-03-01', '400734', 17000, 34000, '400689', 18375, 'ELEAZAR 13:50'),
	(711, '0182', '2025-03-01', '400734', -2550, -5100, '400689', 0, 'MERMA IP DESLAMINADA'),
	(712, '0184', '2025-03-01', '400734', -2114, -4228, '400689', 0, 'MERMA IP REBABA'),
	(713, '02/03/2025', '2025-03-02', '400734', 90, 180, '400689', 90, 'AJUSTE DE 90 PIEZAS  SIGE 2551'),
	(714, '4046522634', '2025-03-03', '400734', 17000, 34000, '400689', 18375, 'ELEAZAR 12:39'),
	(715, '4046524829', '2025-03-03', '401462', 15300, 30600, '400164', 13500, 'ELEAZAR 12:41'),
	(716, '4046533642-4046533659', '2025-03-04', '401742', 1700, 3400, '400166', 0, 'MAURICIO 1:01'),
	(717, '4046541697', '2025-03-04', '401462', 20400, 40800, '400164', 22500, 'ELEAZAR 18:35'),
	(718, '002160', '2025-03-05', '400734', 2304, 4608, '400689', 2304, 'REVERSA DE REMISION 002160'),
	(719, '4046554745', '2025-03-05', '402088', 25200, 0, '401473', 22500, 'ELEAZAR 11:50'),
	(720, '4046554987', '2025-03-05', '401462', 20400, 40800, '400164', 22500, 'ELEAZAR 14:40'),
	(721, '06032025', '2025-03-06', '401462', 23104, 46208, '400164', 23104, 'CORRECION DE FOLIO 002171 SE INGRESA MATERIAL Y SE CANCELA REMISION'),
	(722, '4046573057', '2025-03-06', '402087', 17280, 0, '401473', 18000, 'ELEAZAR 14:56'),
	(723, '4046573053', '2025-03-06', '401462', 20400, 40800, '400164', 22500, 'ELEAZAR 14:59'),
	(724, '4046589510', '2025-03-07', '401462', 20400, 40800, '400164', 22500, 'ELEAZAR 14:55'),
	(725, '4046600215', '2025-03-07', '401735', 11520, 0, '401473', 22500, 'ELEAZAR 17:59'),
	(726, '4046603665', '2025-03-08', '402087', 14400, 0, '401473', 0, 'ELEAZAR 16:20'),
	(727, '4046603318', '2025-03-08', '401735', 24480, 0, '401473', 22500, 'ELEAZAR 16:22'),
	(728, '4046603474', '2025-03-08', '401462', 20400, 40800, '400164', 22500, ''),
	(729, '0186', '2025-03-05', '400734', -1440, -2880, '400689', -1440, 'CORRECCION DE REMISION FOLIO 2160 PROVISIONAL'),
	(730, '4046620959', '2025-03-09', '401462', 20400, 40800, '400164', 20250, 'ELEAZAR 12:55'),
	(731, '4046638441', '2025-03-10', '401735', 10800, 0, '401473', 18000, 'ELEAZAR 15:59'),
	(732, '4046653171', '2025-03-11', '401462', 20400, 40800, '400164', 11250, 'ELEAZAR 10:55'),
	(733, '4046718912', '2025-03-15', '401742', 30600, 61200, '400166', 28800, 'ALAN 02:41'),
	(734, '4046718883', '2025-03-15', '400734', 15300, 30600, '400689', 15750, 'ALAN 02:43'),
	(735, '0193', '2025-03-15', '401742', -1514, -3028, '400166', 0, 'MERMA GEN. 20/4 ENTREGADA'),
	(736, '0194', '2025-03-15', '402087', -2584, 0, '401473', -10214, 'MATERIAL INDIO 12/1 Y DIVISOR 12/1 CONFORME (DEVOLICION)'),
	(737, '0194', '2025-03-15', '401735', -7118, 0, '401473', 0, 'MATERIA CB EXP. CONFORME (DEVOLUCION)'),
	(738, '0192', '2025-03-15', '400734', -4171, -7556, '400689', 0, 'MERMA GEN. 40 OZ. '),
	(739, '0191', '2025-03-15', '401742', -159, -318, '400166', 0, 'CAJA ARMADA RECHAZADA (PRUEVAS DE CALIDAD)'),
	(740, '0189', '2025-03-15', '401735', -396, 0, '401473', 0, 'MERMA CB  PROVBEEDOR 305 Y GRAPADO 91'),
	(741, '0188', '2025-03-15', '402087', -267, 0, '401473', 0, 'MERMA INDIO 12/1 PROVEEDOR 228 GRAPADO 39'),
	(742, '0195', '2025-03-15', '402088', -57, 0, '401473', 0, 'MERMA CB NUEVO  POROVEEDOR 30 GRAPADO 27'),
	(743, '15032501', '2025-03-15', '400734', 15300, 30600, '400689', 15750, 'ELEAZAR 16:58  SMURFY'),
	(744, '1603202501', '2025-03-16', '400734', 17000, 34000, '400689', 7875, 'MATERIALES SMURFIT '),
	(745, '1602202501', '2025-03-16', '401462', 14985, 30600, '400164', 18010, 'ELEAZAR 15:44'),
	(746, '1703202501', '2025-03-17', '401742', 15300, 30600, '400166', 18000, 'ELEAZAR 14:35'),
	(747, '1703202501', '2025-03-17', '400734', 5100, 10200, '400689', 5250, 'ELEAZAR 15:38'),
	(748, '4046794472', '2025-03-19', '400734', 15300, 30600, '400689', 10500, 'ELEAZAR 12:18'),
	(749, '4046794492', '2025-03-19', '401742', 20400, 40800, '400166', 18000, 'ELEAZAR 12:19'),
	(750, '4046799441', '2025-03-19', '400734', 18700, 37400, '400689', 23625, 'ELEAZAR 16:29'),
	(751, '4046826386', '2025-03-21', '400734', 13600, 27200, '400689', 0, 'ALAN 4:16'),
	(752, '2103202501', '2025-03-21', '400734', 13600, 27200, '400689', 28875, 'ELEAZAR 14:45'),
	(753, '22/03/2025', '2025-03-22', '400734', 8500, 17000, '400689', 0, 'FRANK 13:35 MATERIAL IP '),
	(754, '22/03/2025', '2025-03-22', '400734', 6800, 13600, '400689', 15750, 'FRANK 13:37 MATERIAL SW'),
	(755, '23/03/202501', '2025-03-23', '400734', 23800, 47600, '400689', 21000, 'ELEAZAR 13:27'),
	(756, '4046886230', '2025-03-24', '402087', 2584, 0, '401473', 4075, 'ALAN 17:48'),
	(757, '4046897736', '2025-03-25', '401453', 23800, 47600, '400689', 26250, 'ELEAZAR 14:56'),
	(758, '2603202501', '2025-03-26', '401453', 17000, 34000, '400689', 5250, 'ELEAZAR 15:02'),
	(759, '4046921433', '2025-03-27', '401453', 13600, 27200, '400689', 26250, 'ELEAZAR 9:55'),
	(760, '4046937641', '2025-03-28', '401453', 8500, 17000, '400689', 0, 'ELEAZAR 14:59'),
	(761, '4046941988', '2025-03-28', '401453', 10200, 20400, '400689', 11490, 'ELEAZAR 15:00'),
	(762, '0197', '2025-03-28', '401462', 0, -1964, '400164', -3187, 'MATERIALES CONFORME DEVOLUCION'),
	(763, '0197', '2025-03-28', '401742', 0, -8892, '400166', 0, 'MATERIAL CONFORME TAPA 20/4 GEN.'),
	(764, '0198', '2025-03-28', '401462', -529, -1058, '400164', -107, 'MERMA GEN  CUERPO 20/2 ,DIVISOR  Y TAPA'),
	(765, '0199', '2025-03-28', '400734', -579, -1158, '400689', -151, 'MERMA GEN. 40 OZ Y DIV. CKP'),
	(766, '0200', '2025-03-28', '400734', -279, -558, '400689', 0, 'MERMA GEN 40 OZ  SMURFIT'),
	(767, '0200', '2025-03-28', '402087', 0, 0, '401473', -77, 'MERMA DIV. 12/1 LITRO'),
	(768, '0201', '2025-03-28', '401742', -754, -1508, '400166', -1140, 'MERMA GEN. 20/4 Y DIVISOR CKP Y ESCOBEDO'),
	(769, '0196', '2025-03-28', '401742', -18537, -37074, '400166', -26962, 'MATERIALES CONFORME GEN. 20/4 CP.'),
	(770, '0203', '2025-03-28', '402087', -10, 0, '401473', -4, 'MERMA INDIO 12/1 Y DIV. 12/1 LITRO'),
	(771, '0202', '2025-03-28', '402087', 0, 0, '401473', -1350, 'DIV. 12/1 LITRO CONFORME DEVOLUCION'),
	(772, '4046941988', '2025-03-28', '400734', 10200, 20400, '400689', 0, 'ELEAZAR 15:54 INGRESADO NUEVAMENTE'),
	(773, '2803202501', '2025-03-28', '401453', -10200, -20400, '400689', 0, 'REVERSA DE MATERIAL XX  POR ERROR DE INGRESO POR GENERICA'),
	(774, '4046554317', '2025-03-29', '401453', 15300, 30600, '400689', 15750, 'FRANK 13:13 PM '),
	(775, '4046962174', '2025-03-29', '400734', 15300, 30600, '400689', 15750, 'ALAN 18:25'),
	(776, '3003202501', '2025-03-30', '401453', 22100, 44200, '400689', 31500, 'ELEAZAR 17:15'),
	(777, '4046998487', '2025-03-31', '401453', 15300, 30600, '400689', 15750, 'ALAN 21:46'),
	(778, '4047008943', '2025-04-01', '401453', 15300, 30600, '400689', 15750, 'ELEAZAR 16:10'),
	(779, '4047018323', '2025-04-02', '400734', 15300, 30600, '400689', 15750, 'ALAN 4:17'),
	(780, '4047025932', '2025-04-02', '401453', 15300, 30600, '400689', 15750, 'ELEAZAR 16:40'),
	(781, '4047025931', '2025-04-02', '400734', 10200, 20400, '400689', 11025, 'ELEAZAR 17:00'),
	(782, '4047041530', '2025-04-03', '401453', 15300, 30600, '400689', 0, 'ELEAZAR 16:50'),
	(783, '4047054820', '2025-04-04', '401453', 15300, 30600, '400689', 0, 'RICARDO 15:00 HRS'),
	(784, '4047068368', '2025-04-05', '401453', 15300, 30600, '400689', 11025, 'ALAN 4:30'),
	(785, '4047077105', '2025-04-05', '401453', 10200, 20400, '400689', 11025, 'FRANK 16:55 PM'),
	(786, '4047084843', '2025-04-06', '401453', 15300, 30600, '400689', 0, 'ALAN 5:40'),
	(787, '07/04/2025', '2025-04-07', '401453', 17000, 34000, '400689', 40425, 'ALAN 02:11'),
	(788, '4047095260', '2025-04-07', '401453', 15300, 30600, '400689', 14700, 'ELEAZAR 16:29'),
	(789, '4047125148', '2025-04-08', '401453', 15300, 30600, '400689', 15574, 'ELEAZAR 17:11'),
	(790, '4047150410', '2025-04-10', '401453', 15300, 30600, '400689', 14700, 'ALAN  6:00'),
	(791, '40471547995', '2025-04-10', '401453', 15300, 30600, '400689', 14700, 'ELEAZAR 17:10'),
	(792, '0207', '2025-04-10', '400734', -850, -1700, '400689', 0, 'MERMA GENERICA 40 OZ'),
	(793, '0206', '2025-04-10', '401453', -2550, -5100, '400689', 0, 'MERMA XX 40 OZ'),
	(794, '0205', '2025-04-10', '401453', -1700, -3400, '400689', 0, 'MERMA XX 40 OZ'),
	(795, '0204', '2025-04-10', '401453', -1700, -3400, '400689', 0, 'MERMA XX 40 OZ'),
	(796, '4047157230', '2025-04-10', '400734', 15300, 30600, '400689', 14700, 'ELEAZAR 17:35'),
	(797, '0208', '2025-04-11', '401453', -1700, -3400, '400689', 0, 'MERMA GENERICA  40 OZ.'),
	(798, '4047173381', '2025-04-11', '401453', 15300, 30600, '400689', 14700, 'ELEAZAR 17:45'),
	(799, '1204202501', '2025-04-12', '401453', 15300, 30600, '400689', 14700, 'ELEAZAR 17:00'),
	(800, '1304202501', '2025-04-13', '400734', 10200, 20400, '400689', 11025, 'ELEAZAR 17:15'),
	(801, '4047243108', '2025-04-15', '400734', 8500, 17000, '400689', 18375, 'ELEAZAR  12:59'),
	(802, '4047243133', '2025-04-15', '402087', 15120, 0, '401473', 15125, 'ELEAZAR 13:00'),
	(803, '4047264587', '2025-04-16', '402087', 15120, 0, '401473', 13500, 'alan 11:24'),
	(804, '4047274010', '2025-04-17', '402087', 0, 0, '401473', 1895, 'ELEAZAR 13:18'),
	(805, '0212', '2025-04-17', '400689', 0, 0, '400689', -473, 'MERMA DE DIVISOR 40 OZ ESCOBEDO  233 Y CPK 240'),
	(806, '0211', '2025-04-17', '401453', -1209, -2418, '400689', 0, 'MERMA  XX 40 OZ'),
	(807, '0210', '2025-04-17', '400734', -95, -190, '400689', 0, 'MERMA GENERICA 40 OZ SMURFIT'),
	(808, '0214', '2025-04-17', '400734', 0, -1265, '400689', 0, 'DEVOLUCION TAPA GEN. 40 OZ CONFORME. SMURFIT'),
	(809, '0209', '2025-04-17', '400734', -850, -1700, '400689', 0, 'MERMA GENERICA  40 OZ IP'),
	(810, '0215', '2025-04-17', '401453', -2132, -4998, '400689', 0, 'MATERIALES CONFORME XX 40 OZ DEVOLUCION'),
	(811, '0218', '2025-04-17', '400734', -116, -232, '400689', 0, 'MERMA GEN. 40 OZ'),
	(812, '0217', '2025-04-17', '400734', -6509, -11673, '400689', 0, 'DEVOLUCION DE MATERIALES CONFORME GEN  40 OZ'),
	(813, '0216', '2025-04-17', '400734', -1700, -3400, '400689', 0, 'MERMA GEN. 40 OZ'),
	(814, '0219', '2025-04-17', '400734', 0, 0, '400689', -18114, 'DEVOLUCION DE DIVISOR 40 OZ  CONFORME'),
	(815, '4047295831', '2025-04-18', '402087', 5760, 0, '401473', 5587, 'ALAN 11:32'),
	(816, '22/04/2025', '2025-04-22', '400349', 30600, 61200, '400166', 29700, 'ALAN 04:26'),
	(817, '002652', '2025-04-22', '400349', 9108, 18216, '400166', 9108, 'CANCELACION DE REMISION 2652  XX LAGER'),
	(818, '4047345751', '2025-04-22', '400349', 15300, 30600, '400166', 19800, 'ELEAZAR 14:02'),
	(819, '4047345730', '2025-04-22', '402087', 1440, 0, '401473', 4500, 'ELEAZAR 14:03'),
	(820, '23042501', '2025-04-23', '400349', 15300, 30600, '400166', 14850, 'ELEAZAR 15:19'),
	(821, '23042501', '2025-04-23', '400734', 5100, 10200, '400689', 7089, 'ELEAZAR 15:21'),
	(822, '24042501', '2025-04-24', '400349', 15300, 30600, '400166', 14850, 'ELEAZAR 14:42'),
	(823, '24/04/2025', '2025-04-24', '400734', 0, 0, '400689', 1000, 'Pliego 23:31'),
	(824, '25042501', '2025-04-25', '400349', 15300, 30600, '400166', 14850, 'ELEAZAR 10:17'),
	(825, '2604gma', '2025-04-26', '400164', 0, 0, '400164', -1215, 'INICIALIZACIÓN NUEVA CAMPAÑA'),
	(826, '26042', '2025-04-26', '401453', 2561, 5856, '400164', 0, 'INICIALIZACIÓN'),
	(827, '26043', '2025-04-26', '401462', -1555, -1776, '400164', 0, 'INICIALIZACIÓN'),
	(828, '26044', '2025-04-26', '401735', -118, 0, '401473', 0, 'INICIALIZACIÓN'),
	(829, '26045', '2025-04-26', '401473', 0, 0, '401473', -4012, 'INICIALIZACIÓN'),
	(830, '26047', '2025-04-26', '401742', -1960, 2484, '400166', 0, 'INICIALIZACIÓN'),
	(831, '26048', '2025-04-26', '402087', -338, 0, '401473', 0, 'INICIALIZACIÓN'),
	(832, '260410', '2025-04-26', '402088', -338, 0, '401473', 0, 'INICIALIZACIÓN'),
	(833, '260411', '2025-04-26', '402087', 47, 0, '401473', 0, 'AJUSTE'),
	(835, '260422', '2025-04-26', '402088', 0, -49610, '401473', 0, 'INICIALIZACIÓN'),
	(836, '260430', '2025-04-26', '402088', 0, 99220, '401473', 0, 'AJUSTE'),
	(837, '26042501', '2025-04-26', '400349', 15300, 30600, '400166', 14850, 'ELEAZAR 14:55'),
	(838, '27/04/2025', '2025-04-27', '400349', 15300, 30600, '400166', 14850, 'FRANK 11:43AM '),
	(839, '4047385206', '2025-04-28', '400349', 30600, 61200, '400166', 29700, 'ELEAZAR'),
	(840, '4047781373', '2025-04-29', '400349', 15300, 30600, '400166', 14850, 'ELEAZAR 15:00'),
	(841, '29/04/2025', '2025-04-29', '400734', 850, 3400, '400689', 0, 'Ricardo Pliego'),
	(842, '29/04/2025', '2025-04-29', '400734', 0, 0, '400689', 1850, ''),
	(843, '30/04/2025', '2025-04-30', '402112', 3400, 5100, '401744', 7200, 'Ricardo pliego 03:00'),
	(844, '4047530099', '2025-05-02', '400349', 20400, 40800, '400166', 14850, 'FRANK 14:38PM '),
	(845, '03-05-2025', '2025-05-03', '400349', -1700, -3400, '400166', 0, 'FRANK 13:45 PM MERMA IP '),
	(846, '04/05/2025', '2025-05-04', '400349', 15300, 30600, '400166', 14850, 'PLIEGO 02:45'),
	(847, '4047600654', '2025-05-06', '401462', 15300, 30600, '400164', 15750, 'REEMPACADO MAYO'),
	(848, '4047640802', '2025-05-08', '401462', 15300, 30600, '400164', 15750, 'ELEAZAR 13:45'),
	(849, '8/05/2025', '2025-05-08', '401462', 7650, 15300, '400164', 6750, 'PLIEGO 23:19'),
	(850, '09/05/2025', '2025-05-09', '401462', 2550, 5100, '400164', 2250, 'PLIEGO 04:22'),
	(851, '10/05/2025', '2025-05-10', '401462', 10200, 20400, '400164', 11250, 'FRANK 12:45PM '),
	(852, '4047777170', '2025-05-15', '401742', 15300, 30600, '400166', 20062, 'ELEAZAR 12:43'),
	(853, '4047713221', '2025-05-16', '401742', 15300, 30600, '400166', 10800, 'ELEAZAR 12:17'),
	(854, '17/05/2025', '2025-05-17', '401742', 10200, 15300, '400166', 3600, 'PLIEGO 02:13'),
	(855, '1705202501', '2025-05-17', '401742', 20400, 45900, '400166', 28800, 'ELEAZAR 7:18'),
	(856, '4047850421', '2025-05-19', '401742', 15300, 30600, '400166', 14400, 'ELEAZAR 10:25'),
	(857, '0221', '2025-05-19', '402087', -136, 0, '401473', -3399, 'DEVOLUCION MATERIAL CONFORME'),
	(858, '0223', '2025-05-19', '400734', -151, -302, '400689', 0, 'MERMA GEN. 40OZ'),
	(859, '0222', '2025-05-19', '402087', -101, 0, '401473', -79, 'MERMA CAJA INDIO Y DIVISOR 12/1'),
	(860, '0224', '2025-05-19', '400734', -490, -888, '400689', -2572, 'DEVOLUCION  MATERIALES CONFORME'),
	(861, '0235', '2025-05-19', '400734', 0, -2811, '400689', 0, 'DEVOLUCION MATERIAL CONFORME '),
	(862, '0235', '2025-05-19', '402112', 0, 0, '401744', -3753, 'DEVOLUCION MATERIAL CONFORME'),
	(863, '0234', '2025-05-19', '400349', -3025, -6050, '400166', -808, 'MERMA XX LAGER Y DIVISOR 20/4'),
	(864, '0237', '2025-05-19', '402112', -184, -100, '401744', 0, 'MERMA BOHEMIA 12/2'),
	(865, '0236', '2025-05-19', '400734', -18, -36, '400689', -45, 'MERMA GEN. 40 OZ Y DIVISOR 40 OZ'),
	(866, '0239', '2025-05-19', '401462', -444, -888, '400164', -13, 'MERMA GEN. 20/2 Y DIV. 20/2'),
	(867, '0238', '2025-05-19', '401462', 0, -107, '400164', -1148, 'DEVOLUCION MATERIAL CONFORME 20/2 TAPA Y DIVISOR'),
	(868, '21/05/202501', '2025-05-21', '401742', 15300, 30600, '400166', 14400, 'ELEAZAR 13:20'),
	(869, '4047890197', '2025-05-21', '401742', 15300, 30600, '400166', 18000, 'ELEAZAR 14:05'),
	(870, '22/05/2025', '2025-05-22', '401742', 6800, 10200, '400166', 7200, 'PLIEGO 10:42'),
	(871, '4048012528', '2025-05-27', '401742', 8500, 20400, '400166', 18000, 'ELEAZAR 11:15'),
	(872, '4048010136', '2025-05-27', '400349', 15300, 30600, '400166', 14400, 'ELEAZAR 11:16'),
	(873, '4048033563', '2025-05-28', '400349', 30600, 61200, '400166', 18000, 'FRANK 12:22PM'),
	(874, '28/05/2025', '2025-05-28', '401742', 0, 0, '400166', 14850, 'ALAN 20:40'),
	(875, '4048070215', '2025-05-30', '400349', 30600, 61200, '400166', 29700, 'ELEAZAR 11:34'),
	(876, '31052025-01', '2025-05-31', '400349', 15300, 30600, '400166', 19800, 'ELEAZAR 14:27'),
	(877, '01062025-01', '2025-06-01', '400349', 61200, 122400, '400166', 49500, 'ELEAZAR 13:40'),
	(878, '01062025-01', '2025-06-01', '401742', 15300, 30600, '400166', 0, 'ELEAZAR 13:43'),
	(879, '4048149112', '2025-06-03', '400349', 15300, 30600, '400166', 19800, 'FRANK 11:21 AM '),
	(880, '4048167422', '2025-06-04', '401742', 15300, 30600, '400166', 0, 'ELEAZAR 8:50'),
	(881, '4048167379', '2025-06-04', '400349', 15300, 30600, '400166', 29700, 'ELEAZAR 8:51'),
	(886, '4048346613', '2025-06-13', '401742', 35078, 70050, '400166', 69300, 'ELEAZAR 13:26'),
	(887, '4048418954', '2025-06-17', '401742', 30600, 61200, '400166', 260, 'ELEAZAR 14:52'),
	(888, '19-06-2025', '2025-06-19', '401742', 30600, 61200, '400166', 29700, 'FRANK 17:30PM'),
	(889, '0252', '2025-06-05', '401742', -19778, -39450, '400166', 0, 'DEVOLICION MATERIALES  CONFORME'),
	(890, '0251', '2025-06-05', '400349', -20400, -40800, '400166', -24750, 'DEVOLUCION DE MATERIALES CONFORME'),
	(891, '0253', '2025-06-06', '401742', -291, -582, '400166', -403, 'MERMA '),
	(893, '0256', '2025-06-06', '400349', -2244, -4488, '400166', 0, 'MERMA'),
	(895, '0259', '2025-06-20', '400349', -7291, -15000, '400166', 0, 'DEVOLUCION MATERIALES CONFORME'),
	(896, '4048545996', '2025-06-23', '400734', 8500, 17000, '400689', 9200, 'ELEAZAR 14:25'),
	(897, '02/23062025', '2025-06-23', '400734', 11729, 25572, '400689', 13125, 'ELEAZAR 19:35'),
	(898, '4048560195', '2025-06-24', '400734', 8500, 17000, '400689', 18375, 'ELEAZAR 10:57'),
	(899, '4048581552', '2025-06-25', '400734', 8500, 17000, '400689', 5250, 'ELEAZAR 8:59'),
	(900, '4048601136', '2025-06-26', '400734', 8500, 17000, '400689', 9975, 'ELEAZAR 9:32'),
	(901, '4048621577', '2025-06-27', '400734', 8500, 17000, '400689', 7875, 'ELEAZAR 11:34'),
	(902, '0263', '2025-06-27', '401742', -751, -1502, '400166', -582, 'MERMA GEN 20/4'),
	(903, '0264', '2025-06-27', '400734', -196, -392, '400689', 0, 'MERMA GEN. 40 OZ'),
	(904, '28-06-2025', '2025-06-28', '400734', 17000, 34000, '400689', 18375, 'FRANK 11:12AM'),
	(905, '28-06-2025', '2025-06-28', '400349', 14235, 30600, '400166', 0, 'FRANK 13:57PM'),
	(906, '01 29062025', '2025-06-29', '400734', 25500, 51000, '400689', 23625, 'ELEAZAR 13:05'),
	(907, '4048704460', '2025-07-01', '400734', 17000, 34000, '400689', 20692, 'ELEAZAR 14:55'),
	(908, '4048723576', '2025-07-02', '400734', 17000, 34000, '400689', 7875, 'ELEAZAR 12:26'),
	(909, '4048723576', '2025-07-02', '400349', 15300, 30600, '400166', 4950, 'ELEAZAR 12:38'),
	(910, '0103072025', '2025-07-03', '401735', 7200, 0, '401473', 18000, 'ELEAZAR 11:29'),
	(911, '4048746043', '2025-07-03', '401735', 4960, 0, '401473', 12399, 'ELEAZAR 13:29 COMPLEMENTO'),
	(912, '0265', '2025-07-03', '400734', -6419, -13090, '400689', -7875, 'DEVOLUCION DE MATERIALES CONFORME'),
	(913, '0266', '2025-07-03', '400734', 0, 0, '400689', -2921, 'DEVOLUCION DIVISOR RECHAZADO X CALIDAD'),
	(914, '0267', '2025-07-03', '400734', -421, -2954, '400689', 0, 'MERMA GEN. 40 OZ Y TAPA SOBRANTE MERMA  (CHICA)'),
	(915, '0268', '2025-07-03', '400734', 0, 0, '400689', -86, 'MERMA DIVISOR CPK Y ESCOBEDO'),
	(916, '', '2025-07-03', '402088', 7200, 0, '401473', 0, 'ELEAZAR 19:17'),
	(917, '4046782934', '2025-07-04', '402088', 15121, 0, '401473', 9000, 'ELEAZAR 15:59'),
	(918, '0104072025', '2025-07-04', '402088', 2880, 0, '401473', 9000, 'ELEAZAR 18:59'),
	(919, '0105072025', '2025-07-05', '401735', 13680, 0, '401473', 9000, 'ELEAZAR 17:53'),
	(920, '05/07/2025', '2025-07-05', '401735', 8640, 0, '401473', 0, 'PLIEGO 10:10'),
	(921, '0106072025', '2025-07-06', '401735', 7920, 0, '401473', 9000, 'ELEAZAR 17:27'),
	(922, '4048819373', '2025-07-07', '400349', 15300, 30600, '400166', 14850, 'ELEAZAR 14:45'),
	(923, '07/07/2025', '2025-07-07', '401735', 7200, 0, '401473', 0, 'PLIEGO 18:57 PROVICIONAL'),
	(924, '07/07/2025', '2025-07-07', '401742', 20400, 40800, '400166', 0, 'PLIEGO 21:29'),
	(925, '0108072025', '2025-07-08', '401742', 15300, 30600, '400166', 14850, 'ELEAZAR 16:25'),
	(926, '8/07/2025', '2025-07-08', '401735', 7200, 0, '401473', 9000, 'Pliego 21:07'),
	(927, '4048860500', '2025-07-09', '401735', 3600, 0, '401473', 9000, 'ELEAZAR 12:57'),
	(928, '4048860500', '2025-07-09', '402087', 5040, 0, '401473', 0, 'ELEAZAR 12:58'),
	(929, '09/07/2025', '2025-07-09', '402087', 100, 0, '401473', 0, 'PLIEGO 22:38'),
	(930, '09/07/2025', '2025-07-09', '400734', 8500, 17000, '400689', 10500, 'PLIEGO 23:30'),
	(931, '4048882678', '2025-07-10', '400734', 6419, 13600, '400689', 10500, 'ELEAZAR 15:40'),
	(932, '4048882678', '2025-07-10', '401742', 0, 0, '400166', 4950, 'ELEAZAR 15:42'),
	(933, '10/07/2025', '2025-07-11', '400734', 8500, 17000, '400689', 7275, 'PLIEGO 00:10'),
	(934, '4048899175', '2025-07-11', '400734', 10200, 20400, '400689', 10500, 'Folio: 1118'),
	(935, '12/07/2025', '2025-07-12', '400734', 6800, 13600, '400689', 7875, 'PLIEGO 03:14'),
	(936, '12-07-2025', '2025-07-12', '400734', 8500, 17000, '400689', 7875, 'FRANK 10:45AM'),
	(937, '13/07/2025', '2025-07-13', '400734', 6800, 13600, '400689', 10500, 'PLIEGO 02:34'),
	(938, '0113072025', '2025-07-13', '400734', 17000, 34000, '400689', 10500, 'ELEAZAR 10:32'),
	(939, '4048956494', '2025-07-14', '400734', 10200, 20400, '400689', 10500, 'ELEAZAR 15:07'),
	(940, '4048977029', '2025-07-15', '400734', 17000, 34000, '400689', 18375, 'ELEAZAR 16:19'),
	(941, '4048977018', '2025-07-15', '401742', 10200, 20400, '400166', 9900, 'ELEAZAR 16:20'),
	(942, '4048981693', '2025-07-16', '400734', 17000, 34000, '400689', 15750, 'ELEAZAR 14:52'),
	(943, '4049014839', '2025-07-17', '400734', 17000, 34000, '400689', 18375, 'ELEAZAR 14:53'),
	(944, '4049030466', '2025-07-18', '401742', 10200, 20400, '400166', 9900, 'ELEAZAR 15:07'),
	(945, '4049030524', '2025-07-18', '400734', 8500, 17000, '400689', 18375, 'ELEAZAR 15:10'),
	(946, '18/07/2025', '2025-07-18', '400734', 17000, 34000, '400689', 10500, 'Pliego 11:56'),
	(947, '0119072025', '2025-07-19', '400734', 17000, 34000, '400689', 15750, 'ELEAZAR 17:33'),
	(948, '0120072025', '2025-07-20', '400734', 17000, 34000, '400689', 15750, 'ELEAZAR 19:31'),
	(949, '4049091817', '2025-07-21', '400734', 17000, 34000, '400689', 18375, 'ELEAZAR 18:22'),
	(950, '22/07/2025', '2025-07-22', '401742', 5100, 10200, '400166', 9900, 'Pliego 11:53'),
	(951, '0122072025', '2025-07-22', '400734', 17000, 34000, '400689', 15750, 'ELEAZAR 6:42'),
	(952, '0123072025', '2025-07-23', '400734', 8500, 17000, '400689', 7875, 'ELEAZAR 17:39'),
	(953, '1176', '2025-07-24', '400349', 10200, 20400, '400166', 9900, ''),
	(954, '0124072025', '2025-07-24', '400734', 17000, 34000, '400689', 21000, 'ELEAZAR 17:39'),
	(955, '4049170586', '2025-07-25', '400349', 10200, 20400, '400166', 9900, 'ELEAZAR 19:34'),
	(956, '4049170539', '2025-07-25', '400734', 17000, 34000, '400689', 18375, 'ELEAZAR  19:37'),
	(957, '0126072025', '2025-07-26', '401742', 10200, 20400, '400166', 0, 'ELEAZAR 15:57'),
	(958, '0126072025', '2025-07-26', '400734', 17000, 34000, '400689', 18375, 'ELEAZAR 20:39'),
	(959, '0127072025', '2025-07-27', '400734', 17000, 34000, '400689', 18375, 'ELEAZAR 17:52'),
	(960, '0127072025', '2025-07-27', '401742', 5100, 10200, '400166', 9900, 'ELEAZAR 17:55'),
	(961, '29/07/2025', '2025-07-29', '400734', 8500, 17000, '400689', 7875, 'Pliego 04:16'),
	(962, '29/07/2025', '2025-07-29', '400349', 10200, 20400, '400166', 9900, 'Pliego 04:18'),
	(963, '4049242206', '2025-07-29', '400734', 11900, 23800, '400689', 13125, 'ELEAZAR 13:18'),
	(964, '4049262496', '2025-07-30', '400734', 17000, 34000, '400689', 18375, 'ELEAZAR 13:30'),
	(965, '4049280947', '2025-07-31', '400349', 10200, 20400, '400166', 9900, 'ELEAZAR 12:22'),
	(966, '4049280943', '2025-07-31', '400734', 8500, 17000, '400689', 7875, 'ELEAZAR 12:24'),
	(967, '01/08/25', '2025-08-01', '400734', 17000, 34000, '400689', 21000, 'PLIEGO 04:30'),
	(968, '0101082025', '2025-08-01', '400349', 10200, 20400, '400166', 14850, 'ELEAZAR 13:10'),
	(969, '0085', '2025-08-01', '401742', -3929, -6538, '400166', 0, 'DEVOLUCION'),
	(970, '02/08/2025', '2025-08-02', '400349', 19905, 39800, '400166', 14850, 'FRANK 16:40PM'),
	(971, '02/08/2025', '2025-08-02', '400734', 8500, 1700, '400689', 7875, 'FRANK 16:42PM'),
	(972, '0103082025', '2025-08-03', '400734', 8500, 17000, '400689', 7875, 'ELEAZAR 15:49'),
	(973, '03/08/25', '2025-08-03', '400734', 0, 0, '400689', 11812, 'pliego 19:44'),
	(974, '04/08/2025', '2025-08-04', '400734', 8500, 17000, '400689', 5250, 'frank 8:06am'),
	(975, '4049361405', '2025-08-04', '400734', 8500, 17000, '400689', 7875, 'FRANK 17:22PM'),
	(976, '05/08/2025', '2025-08-05', '400734', 15300, 30600, '400689', 15750, 'FRANK 14:36PM'),
	(977, '06/8/2025', '2025-08-06', '400734', 8500, 17000, '400689', 7875, 'pliego 04:54'),
	(978, '4049401094', '2025-08-06', '400734', 13600, 27200, '400689', 15750, 'FRANK 18:25PM'),
	(979, '4049422064', '2025-08-07', '400734', 17000, 34000, '400689', 18375, 'FRANK 18:20PM'),
	(980, '4049438595', '2025-08-08', '400734', 10200, 20400, '400689', 5250, ''),
	(981, '09/08/2025', '2025-08-09', '400734', 10200, 20400, '400689', 10500, 'Ginez 05:41'),
	(982, '10/08/2025', '2025-08-10', '400734', 17000, 34000, '400689', 18375, 'ginez 04:17'),
	(983, '11/08/2025', '2025-08-11', '400734', 13600, 27200, '400689', 13125, 'Ginez  04:41'),
	(984, '4049498678', '2025-08-11', '400734', 17000, 34000, '400689', 18375, 'FRANK 17:10PM'),
	(985, '13/08/2025', '2025-08-13', '400734', 17000, 34000, '400689', 18375, 'Pliego 04:21'),
	(986, '13/08/2025', '2025-08-13', '402088', 1440, 0, '401473', 4500, 'Pliego 04:22'),
	(988, '404954170', '2025-08-14', '400734', 10200, 20400, '400689', 10500, 'Pliego 02:51'),
	(990, '14/08/2025', '2025-08-14', '402088', 4320, 0, '401473', 4500, 'Pliego 02:55'),
	(994, '140825', '2025-08-14', '400734', 8500, 1700, '400689', 0, 'P/COMPLEMENTO'),
	(995, '15/08/2025', '2025-08-15', '400734', 8500, 17000, '400689', 16831, 'Ginez 05:16'),
	(997, '15/08/2025', '2025-08-15', '400734', 17000, 34000, '400689', 18375, 'FRANK 17:54PM'),
	(998, '15/08/2025', '2025-08-15', '400349', 15300, 30600, '400166', 14850, 'FRANK 17:55PM'),
	(999, '16/08/2025', '2025-08-16', '400734', 6252, 11186, '400689', 0, 'FRANK 14:30PM'),
	(1000, '16/08/2025', '2025-08-16', '400734', 10200, 20400, '400689', 14700, 'FRANK 17:55PM MATERIAL CP'),
	(1001, '16/08/2025', '2025-08-16', '402088', 2160, 0, '401473', 0, 'FRANK 17:56PM'),
	(1002, '17/08/2025', '2025-08-17', '400734', 11900, 23800, '400689', 11025, 'FRANK 15:50PM'),
	(1003, '180825', '2025-08-18', '400734', 20400, 40800, '400689', 20400, 'para remisionar'),
	(1005, '4049685466', '2025-08-20', '401742', 40800, 81600, '400166', 49500, ''),
	(1006, '4049686748', '2025-08-20', '401735', 2160, 0, '401473', 4500, ''),
	(1008, '4049689513', '2025-08-20', '402088', 3600, 0, '401473', 4500, 'OK'),
	(1009, '4049724561', '2025-08-22', '400349', 20400, 408000, '400166', 0, 'FRANK 13:06PM'),
	(1010, '24/08/2025', '2025-08-24', '401742', 20400, 40800, '400166', 29700, 'FRANK 11:02AM'),
	(1011, '25/08/2025', '2025-08-25', '402088', 4320, 0, '401473', 9000, ''),
	(1012, '27/08/2025', '2025-08-27', '401742', 20400, 40800, '400166', 19800, 'FRANK 9:05AM'),
	(1013, '29/08/2025', '2025-08-29', '400349', 5100, 10200, '400166', 9900, 'Pliego 05:53'),
	(1014, 'PROV GM290825', '2025-08-29', '401742', 40800, 81600, '400166', 39600, 'VERIFICAR VS REMISIONES'),
	(1015, '4049821376', '2025-08-20', '401735', 2880, 0, '401473', 0, 'FRANK 13:41PM PENDIENTE'),
	(1016, '30/08/2025', '2025-08-30', '400349', 5100, 10200, '400166', 29700, 'Pliego 05:32'),
	(1017, '02/09/2025', '2025-09-02', '401742', 10200, 20400, '400166', 14850, 'Pliego 02:42'),
	(1018, '02/09/2025', '2025-09-02', '400349', 5100, 10200, '400166', 0, 'Pliego 06:18'),
	(1019, '02/09/2025', '2025-09-02', '401742', 20400, 40800, '400166', 19800, 'FRANK 14:50 PM PAKING PENDIENTE '),
	(1020, '03/09/2025', '2025-09-03', '400349', 5100, 10200, '400166', 4950, ''),
	(1021, '4049944181', '2025-09-03', '400349', 15300, 30600, '400166', 0, 'FRANK 13:14PM'),
	(1022, '4049944088', '2025-09-03', '401742', 25500, 51000, '400166', 39600, 'FRANK 13:15PM'),
	(1023, '4049944234', '2025-09-03', '401742', 51000, 102000, '400166', 64350, 'FRANK 13:17PM'),
	(1024, '4049944240', '2025-09-03', '401735', 7200, 0, '401473', 4500, 'FRANK 13:18PM'),
	(1025, '03/09/2025', '2025-09-03', '400349', 15300, 30600, '400166', 19800, 'FRANK 13:22PM'),
	(1026, '03/09/2025', '2025-09-03', '401742', 1700, 5100, '400166', 0, 'FRANK 13:24PM'),
	(1027, '06/09/2025', '2025-09-06', '402087', 4320, 0, '401473', 2700, 'Pliego 04:31'),
	(1028, '06092025', '2025-09-06', '402087', 5760, 0, '401473', 4500, 'FRANK 13:37PM'),
	(1029, '06092025', '2025-09-06', '400349', 10200, 20400, '400166', 9900, 'FRANK 13:38PM'),
	(1030, '08092025', '2025-09-08', '402087', 5760, 0, '401473', 9000, 'FRANK 13:40PM PACKING PENDIENTE '),
	(1031, '09/09/2025', '2025-09-09', '400349', 10200, 20400, '400166', 9900, 'Pliego 04:02'),
	(1032, '09/09/2025', '2025-09-09', '402087', 4320, 0, '401473', 0, 'pliego 04:03'),
	(1033, '0110092025', '2025-09-10', '402087', 5760, 0, '401473', 4500, 'ELEAZAR'),
	(1034, '12/09/2025', '2025-09-12', '400349', 10200, 20400, '400166', 9900, 'Pliego 01:02'),
	(1035, '12092025', '2025-09-12', '402088', 8640, 0, '401473', 9000, 'frank 13:31pm paking pendiente '),
	(1036, '13/09/2025', '2025-09-13', '400349', 5100, 10200, '400166', 4950, 'Pliego 01:34'),
	(1037, '170925aj', '2025-09-17', '400164', -228, 0, '400164', 0, ''),
	(1038, '25222', '2025-09-17', '400164', 228, 0, '400164', -228, ''),
	(1039, '25332222', '2025-09-17', '400689', 0, 0, '400689', -39375, ''),
	(1041, '25337777', '2025-09-17', '401744', 0, 0, '401744', -135, ''),
	(1042, '25338888', '2025-09-17', '400734', -14246, 3067, '400689', 0, ''),
	(1043, '25339999', '2025-09-17', '401462', -195, -283, '400164', 0, ''),
	(1044, '25336969', '2025-09-17', '401735', -6672, 0, '401473', 0, ''),
	(1045, '2633000', '2025-09-17', '401742', -83282, -169584, '400166', 0, ''),
	(1047, '26332222', '2025-09-17', '402087', -3049, 0, '401473', 0, ''),
	(1048, '2633333', '2025-09-17', '402112', 96, 1624, '401744', 0, ''),
	(1049, '2633555', '2025-09-17', '402088', -5375, -88612, '401473', 0, ''),
	(1050, '2633666', '2025-09-17', '401735', 0, 177224, '401473', -4073, ''),
	(1051, '2633999', '2025-09-17', '401735', -177224, 0, '401473', 0, ''),
	(1052, '2733000', '2025-09-17', '402088', 177224, 0, '401473', 0, ''),
	(1053, '27333', '2025-09-17', '401735', 177224, -177224, '401473', 0, ''),
	(1054, '283333', '2025-09-17', '402088', -177224, 177224, '401473', 0, ''),
	(1055, '17092025AJUSTELT', '2025-09-17', '402088', 714, 0, '401473', 2446, ''),
	(1056, '2833666', '2025-09-17', '400349', -2669, -374240, '400166', -107942, ''),
	(1057, '17092025', '2025-09-17', '400349', 4763, 5705, '400166', 2125, 'REINICIO DE INVENTARIO '),
	(1058, '4050195119', '2025-09-18', '400349', 10200, 20400, '400166', 9900, 'F-0972'),
	(1059, '4050211761', '2025-09-19', '402088', 2880, 0, '401473', 4500, 'frank 09:09am'),
	(1060, '4050215960', '2025-09-19', '402088', 2160, 0, '401473', 0, 'frank 13:55pm '),
	(1061, '4050215791', '2025-09-19', '400349', 5100, 10200, '400166', 4950, 'frank 13:56pm'),
	(1062, '4050233072', '2025-09-20', '402088', 2880, 0, '401473', 4500, 'FRANK 12:37PM'),
	(1063, '4050262753', '2025-09-22', '402088', 3600, 0, '401473', 4500, 'ELEAZAR 12:14'),
	(1064, '4056280858', '2025-09-23', '400349', 5100, 10200, '400166', 4950, 'ELEAZAR 11:51'),
	(1065, '4050297197', '2025-09-24', '400349', 5100, 10200, '400166', 4950, 'frank 08:50am'),
	(1066, '0276', '2025-09-24', '400349', -1700, -3400, '400166', 0, 'merma devolucion'),
	(1067, '4050301599', '2025-09-24', '400349', 5100, 10200, '400166', 4950, 'frank 13:50pm'),
	(1068, '4050318504', '2025-09-25', '400349', 5100, 10200, '400166', 4950, 'FRANK 11:00AM'),
	(1069, '4050337460', '2025-09-26', '400349', 5100, 10200, '400166', 4950, 'FRANK 10:43am '),
	(1070, '27092025', '2025-09-27', '401742', 10200, 20400, '400166', 19800, 'FRANK 11:57AM'),
	(1071, '4050390629', '2025-09-27', '401742', 20400, 40800, '400166', 19800, 'FRANK 13:52PM'),
	(1072, '4050388368', '2025-09-27', '401742', 4273, 6852, '400166', 0, 'FRANK 13:54PM'),
	(1073, '4050388034', '2025-09-27', '400349', 5100, 10200, '400166', 9900, 'FRANK 13:55PM'),
	(1074, '4050422171', '2025-10-01', '401742', 20400, 40800, '400166', 19800, 'ELEAZAR 9:11'),
	(1075, '02102025', '2025-10-02', '401742', 20400, 40800, '400166', 20285, 'FRANK 14:00PM'),
	(1076, '03102025', '2025-10-03', '402088', 2724, 0, '401473', 0, 'frank 11:43am'),
	(1079, '4050517806', '2025-10-06', '401742', 20400, 40800, '400166', 19800, 'FRANK 15:03PM'),
	(1080, '4050536465', '2025-10-07', '401742', 20400, 40800, '400166', 19800, 'ELEZAR 15:45'),
	(1083, '0109102025', '2025-10-09', '401742', 10200, 20400, '400166', 9900, 'ELEAZAR 15:40'),
	(1084, '4050584990', '2025-10-10', '401742', 20400, 40800, '400166', 19800, 'ELEAZAR 13:29'),
	(1085, '0110102025', '2025-10-10', '400349', 15300, 30600, '400166', 14850, 'ELEAZAR 14:00'),
	(1086, '0112102025', '2025-10-12', '400349', 20400, 40800, '40166', 19800, 'ELEAZAR 13:17'),
	(1089, '278', '2025-10-13', '402088', -1920, 0, '401473', -2925, 'DEVOLUCIÓN DE MATERIAL CONFORME 10/10/25'),
	(1090, '281', '2025-10-13', '402088', -83, 0, '401473', -22, 'MERMA 10/10/2025'),
	(1092, '13102', '2025-10-13', '400349', 0, 0, '400166', 10385, ''),
	(1093, 'REV1070', '2025-10-13', '400349', 0, 0, '400166', -9900, 'CORRECIÓN POR ERROR DE CAPTURA'),
	(1094, 'REV 1075', '2025-10-13', '400349', 0, 0, '400166', -485, 'CORRECCIÓN POR ERRO DE CAPTURA 1075'),
	(1095, '4050635585', '2025-10-13', '400349', 20400, 40800, '400166', 19800, 'ELEAZAR 14:47'),
	(1096, '14102025AJUSTE DV', '2025-10-14', '400349', 0, 0, '400166', 19800, 'AJUSTE '),
	(1097, 'AJUSTE 1410', '2025-10-14', '402088', 5, -25920, '401473', -39, ''),
	(1098, 'AJUSTE 14102', '2025-10-14', '402088', 0, 51840, '401473', 0, '0'),
	(1100, '4050658706', '2025-10-14', '400349', 20400, 40800, '400166', 19800, 'ELEAZAR 17:12'),
	(1101, '4050671049', '2025-10-15', '400349', 30600, 61200, '400166', 29700, 'ELEAZAR 16:24'),
	(1102, '282', '2025-10-16', '401742', -392, 0, '400166', 0, 'DEVOLUCIÓN CARTON CAPITAL'),
	(1104, '4050691887', '2025-10-16', '400349', 25500, 51000, '400166', 24750, ''),
	(1105, '4050705779', '2025-10-17', '400349', 30600, 61200, '400166', 29700, ''),
	(1106, '0118102025', '2025-10-18', '400349', 30600, 61200, '400166', 29700, 'ELEAZAR 18:35'),
	(1107, '0119102025', '2025-10-19', '400349', 30600, 61200, '400166', 29700, 'ELEAZAR 12:01'),
	(1108, '4050756725', '2025-10-20', '400349', 20400, 40800, '400166', 19800, 'ELEAZAR 15:35'),
	(1109, '4050767781', '2025-10-21', '400349', 30600, 61200, '400166', 29700, 'ELEAZAR 16:14'),
	(1110, '221025aj', '2025-10-22', '400349', 1472, 2944, '400166', 1472, 'Ajuste por remisión NR'),
	(1112, '4050783394', '2025-10-22', '400349', 30044, 61200, '400166', 29700, 'ELEAZAR 16:03'),
	(1113, '4050797259', '2025-10-23', '400349', 25500, 51000, '400166', 24750, 'ELEAZAR 16:40'),
	(1114, '4050809101', '2025-10-24', '400349', 15300, 30600, '400166', 14850, 'ELEAZAR 12:03'),
	(1115, '4050809721', '2025-10-24', '402087', 600, 0, '401473', 627, 'ELEAZAR 12:05'),
	(1116, '251025dev', '2025-10-25', '402087', -168, 0, '401473', -195, 'DEVOLUCIÓN'),
	(1117, '0127102025', '2025-10-27', '400349', 15300, 30600, '400166', 14850, 'ELEAZAR 14:31'),
	(1118, '0284', '2025-10-27', '401742', -16244, -31926, '400166', 0, 'DEVOLUCION  DE MATERIALES CONFORME GENERICA 20/4'),
	(1119, '4050885020', '2025-10-29', '400349', 25500, 51000, '400166', 24750, 'ELEAZAR 10:55'),
	(1120, '268DEV', '2025-10-30', '400349', -8500, -17000, '400166', -3225, 'merma octubre'),
	(1121, 'DEV 288', '2025-10-30', '401742', -639, -659, '400166', 0, 'MERMA OCTUBRE'),
	(1122, '4050901184', '2025-10-30', '400349', 15300, 30600, '400166', 14850, 'ELEAZAR 12:05'),
	(1123, 'AJUSTE OCT CERO', '2025-10-30', '401742', 819, 1367, '400166', 0, 'AJUSTE DE SOBRANTES A CEROS'),
	(1124, '4050916791', '2025-10-31', '400349', 15300, 30600, '400166', 9900, 'ELEAZAR 9:27'),
	(1125, '31/10/2025', '2025-10-31', '401735', 2160, 0, '401473', 4500, 'pliego 23:21'),
	(1126, '01/11/2025', '2025-11-01', '401735', 2160, 0, '401473', 2160, 'pliego 12:02'),
	(1127, '0290', '2025-11-01', '401735', 0, 0, '401473', -2350, 'DEVOLUCION DE MATERIAL CONFORME'),
	(1128, '4050999216', '2025-11-05', '400349', 10200, 20400, '400166', 7200, 'ELEAZAR 11:53'),
	(1129, '0511AJ', '2025-11-05', '401473', 0, 0, '401473', 10, 'AJUSTE'),
	(1130, '4051015709', '2025-11-06', '400349', 10200, 20400, '400166', 10800, 'ELEAZAR 11:45'),
	(1131, '4051032945', '2025-11-07', '400349', 10200, 20400, '400166', 10800, 'ELEAZAR 10:23'),
	(1132, '0108112025', '2025-11-08', '400349', 15300, 30600, '400166', 14400, 'ELEAZAR 13:25'),
	(1134, '0293', '2025-11-12', '400349', -4985, -12540, '400166', -6110, 'devolucion de materiales conforme'),
	(1135, '0296', '2025-11-12', '400349', -994, -1988, '400166', -341, 'devolucion merma xxl 20/4 y divisor 20/4'),
	(1136, 'AJUSTE 1211', '2025-11-12', '400349', -2930, -581, '400166', 1016, 'DIFERENCIAS '),
	(1137, '0122112025', '2025-11-22', '401742', 15300, 30600, '400166', 18000, 'ELEAZAR 11:48'),
	(1138, '4051329664', '2025-11-25', '401742', 10920, 21726, '400166', 13300, 'ELEAZAR 10:39'),
	(1139, '4051363891', '2025-11-27', '401742', 15300, 29292, '400166', 10800, 'ELEAZAR 13:06'),
	(1140, 'AJUSTE 2811 GENCTO', '2025-11-28', '401742', 27048, 54096, '400166', 27048, ''),
	(1141, '0128112025', '2025-11-28', '401742', 3400, 10200, '400166', 3600, 'ELEAZAR'),
	(1142, '0128112025', '2025-11-28', '400734', 8500, 17000, '400689', 7059, 'ELEAZAR'),
	(1143, '5354', '2025-11-28', '400734', 850, 1700, '400689', 850, ''),
	(1144, 'ger', '2025-11-28', '401742', 10, 20, '400166', 10, 'vv'),
	(1145, '4051385248', '2025-11-28', '400734', 6800, 13600, '400689', 7059, 'ELEAZAR 15:22'),
	(1146, '4051385245', '2025-11-28', '401742', 2616, 8792, '400166', 1690, 'ELEAZAR 15:25'),
	(1147, '4051486904', '2025-12-04', '401462', 1275, 5100, '400164', 2250, 'pliego 13:29'),
	(1149, '0117122025', '2025-12-17', '400734', 8555, 17231, '400689', 14700, 'ELEAZAR 9:22'),
	(1150, '0118122025', '2025-12-18', '400734', 8500, 17374, '400689', 3675, 'ELEAZAR 14:43'),
	(1151, '4051740060', '2025-12-20', '400734', 850, 3400, '400689', 0, 'ELEAZAR 12:05'),
	(1152, '4052402099', '2026-02-03', '401742', 30600, 61200, '400166', 28800, 'ELEAZAR 6:56');

-- Volcando estructura para tabla bd_rpm1.inventario
CREATE TABLE IF NOT EXISTS `inventario` (
  `inv_pro_codigo` varchar(10) NOT NULL,
  `inv_entradas` int(11) DEFAULT 0,
  `inv_entradas1` int(11) DEFAULT 0,
  `inv_entradas2` int(11) DEFAULT 0,
  `inv_salidas` int(11) DEFAULT 0,
  `inv_stock` int(11) DEFAULT 0,
  `inv_stock2` int(11) DEFAULT 0,
  `inv_stock3` int(11) DEFAULT 0,
  PRIMARY KEY (`inv_pro_codigo`),
  CONSTRAINT `inventario_ibfk_1` FOREIGN KEY (`inv_pro_codigo`) REFERENCES `producto` (`pro_codigo`) ON DELETE CASCADE ON UPDATE CASCADE
) ENGINE=InnoDB DEFAULT CHARSET=utf8mb4 COLLATE=utf8mb4_general_ci;

-- Volcando datos para la tabla bd_rpm1.inventario: ~14 rows (aproximadamente)
INSERT INTO `inventario` (`inv_pro_codigo`, `inv_entradas`, `inv_entradas1`, `inv_entradas2`, `inv_salidas`, `inv_stock`, `inv_stock2`, `inv_stock3`) VALUES
	('400164', 0, 0, 3250317, 1083491, 0, 0, 2166826),
	('400349', 10537521, 21075042, 0, 3512507, 7025014, 14050028, 0),
	('400689', 0, 0, 4290886, 1437810, 0, 0, 2853076),
	('400734', 3331305, 6664805, 0, 1118635, 2212670, 4427535, 0),
	('401453', 957795, 1915590, 0, 319265, 638530, 1277060, 0),
	('401462', 734673, 1471896, 0, 245266, 489407, 981364, 0),
	('401473', 0, 0, 864855, 288285, 0, 0, 576570),
	('401735', 328368, 0, 0, 109456, 218912, 0, 0),
	('401742', 11484367, 22978228, 0, 3815183, 7669184, 15347862, 0),
	('401744', 0, 0, 9936, 3312, 0, 0, 6624),
	('402069', 2548768, 5086624, 0, 840410, 1708358, 3405804, 0),
	('402087', 290274, 0, 0, 96758, 193516, 0, 0),
	('402088', 246213, 492426, 0, 82071, 164142, 328284, 0),
	('402112', 9936, 19872, 0, 3312, 6624, 13248, 0);

-- Volcando estructura para tabla bd_rpm1.merma
CREATE TABLE IF NOT EXISTS `merma` (
  `mer_id` int(20) NOT NULL AUTO_INCREMENT,
  `mer_nremision` varchar(20) DEFAULT NULL,
  `mer_pro_codigo` varchar(10) DEFAULT NULL,
  `mer_fecha` date NOT NULL,
  `mer_cantidad` int(4) NOT NULL,
  `mer_cantidad1` int(11) NOT NULL,
  `mer_pro_codigo2` varchar(20) DEFAULT NULL,
  `mer_cantidad2` int(11) NOT NULL,
  `mer_obs` varchar(5000) DEFAULT NULL,
  PRIMARY KEY (`mer_id`),
  KEY `mer_pro_codigo` (`mer_pro_codigo`),
  CONSTRAINT `merma_ibfk_1` FOREIGN KEY (`mer_pro_codigo`) REFERENCES `producto` (`pro_codigo`) ON DELETE CASCADE ON UPDATE CASCADE
) ENGINE=InnoDB DEFAULT CHARSET=utf8mb4 COLLATE=utf8mb4_general_ci;

-- Volcando datos para la tabla bd_rpm1.merma: ~0 rows (aproximadamente)

-- Volcando estructura para tabla bd_rpm1.producto
CREATE TABLE IF NOT EXISTS `producto` (
  `pro_codigo` varchar(10) NOT NULL,
  `pro_descripcion` varchar(150) NOT NULL,
  PRIMARY KEY (`pro_codigo`)
) ENGINE=InnoDB DEFAULT CHARSET=utf8mb4 COLLATE=utf8mb4_general_ci;

-- Volcando datos para la tabla bd_rpm1.producto: ~18 rows (aproximadamente)
INSERT INTO `producto` (`pro_codigo`, `pro_descripcion`) VALUES
	('400164', 'DIV. LAM. 40 OZ'),
	('400166', 'DIV.20/4 LAM.\n'),
	('400349', '20/4 XX-LAG.BLISS CJA.'),
	('400689', 'DIV. LAM. 40 OZ'),
	('400734', '12/1 GENERICA BLISS 40 OZ.'),
	('401453', '12/1 XXL BLISS 40 OZ.'),
	('401462', '20/2 CJA BLISS GENERICA'),
	('401473', 'DIV. 12/1 NR'),
	('401477', 'DIV. 12/2 BOH. GENÉRICA'),
	('401510', 'DIV.20/7 OZ. EXP.'),
	('401735', 'EXP. CARTA BLANCA 12/1 US'),
	('401742', 'CAJA BLISS 20/4 GENERICA'),
	('401744', 'DIVISOR 12/2 BOHEMIA'),
	('401947', 'CJA XX-LAGER 7 OZ.'),
	('402069', 'XX LAGER 20/2'),
	('402087', 'NR INDIO 12/1 NAC'),
	('402088', 'NR CARTA BLANCA 12/1 NAC '),
	('402112', 'CAJA RET BOHEMIA BLISS 12PK 355ML');

-- Volcando estructura para tabla bd_rpm1.salida
CREATE TABLE IF NOT EXISTS `salida` (
  `sal_id` int(20) NOT NULL AUTO_INCREMENT,
  `sal_pro_codigo` varchar(10) DEFAULT NULL,
  `sal_fecha` date NOT NULL,
  `sal_cantidad` int(4) NOT NULL,
  `sal_cantidad1` int(11) NOT NULL,
  `sal_pro_codigo2` varchar(20) DEFAULT NULL,
  `sal_pro_des` varchar(20) DEFAULT NULL,
  `sal_cantidad2` int(11) NOT NULL,
  PRIMARY KEY (`sal_id`),
  KEY `sal_pro_codigo` (`sal_pro_codigo`),
  CONSTRAINT `salida_ibfk_1` FOREIGN KEY (`sal_pro_codigo`) REFERENCES `producto` (`pro_codigo`) ON DELETE CASCADE ON UPDATE CASCADE
) ENGINE=InnoDB AUTO_INCREMENT=4351 DEFAULT CHARSET=utf8mb4 COLLATE=utf8mb4_general_ci;

-- Volcando datos para la tabla bd_rpm1.salida: ~3,781 rows (aproximadamente)
INSERT INTO `salida` (`sal_id`, `sal_pro_codigo`, `sal_fecha`, `sal_cantidad`, `sal_cantidad1`, `sal_pro_codigo2`, `sal_pro_des`, `sal_cantidad2`) VALUES
	(390, '402069', '2024-02-27', 2304, 4608, '400164', 'divisor 20/2', 2304),
	(391, '402069', '2024-02-27', 2304, 4608, '400164', 'divisor 20/2', 2304),
	(392, '402069', '2024-02-27', 2304, 4608, '400164', 'divisor 20/2', 2304),
	(393, '402069', '2024-02-27', 2304, 4608, '400164', 'divisor 20/2', 2304),
	(394, '402069', '2024-02-27', 2304, 4608, '400164', 'Divisor 20/2', 2304),
	(395, '402069', '2024-02-27', 2304, 4608, '400164', 'Divisor 20/2', 2304),
	(396, '402069', '2024-02-28', 2304, 4608, '400164', 'divisor 20/2', 2304),
	(397, '402069', '2024-02-28', 2304, 4608, '400164', 'divisor 20/2', 2304),
	(398, '402069', '2024-02-28', 2304, 4608, '400164', 'divisor 20/2', 2304),
	(399, '402069', '2024-02-28', 2304, 4608, '400164', 'divisor 20/2', 2304),
	(400, '402069', '2024-02-28', 2304, 4608, '400164', 'divisor 20/2', 2304),
	(401, '402069', '2024-02-28', 2304, 4608, '400164', 'divisor 20/2', 2304),
	(402, '402069', '2024-02-28', 2304, 4608, '400164', 'Divisor 20/2', 2304),
	(403, '402069', '2024-02-28', 2304, 4608, '400164', 'Divisor 20/2', 2304),
	(404, '402069', '2024-02-28', 2304, 4608, '400164', 'Divisor 20/2', 2304),
	(405, '402069', '2024-02-28', 2304, 4608, '400164', 'Divisor 20/2', 2304),
	(406, '402069', '2024-02-28', 2304, 4608, '400164', 'Divisor 20/2', 2304),
	(407, '402069', '2024-02-29', 2304, 4608, '400164', 'divisor 20/2', 2304),
	(408, '402069', '2024-02-29', 2304, 4608, '400164', 'divisor 20/2', 2304),
	(409, '402069', '2024-02-29', 2304, 4608, '400164', 'divisor 20/2', 2304),
	(410, '402069', '2024-02-29', 2304, 4608, '400164', 'divisor 20/2', 2304),
	(411, '402069', '2024-02-29', 2304, 4608, '400164', 'divisor 20/2', 2304),
	(412, '402069', '2024-02-29', 2304, 4608, '400164', '', 2304),
	(413, '402069', '2024-02-29', 2304, 4608, '400164', 'Divisor 20/2', 2304),
	(414, '402069', '2024-02-29', 2304, 4608, '400164', 'Diviosr 20/2', 2304),
	(415, '402069', '2024-03-01', 2304, 4608, '400164', 'Divisor 20/2', 2304),
	(416, '402069', '2024-02-29', 2304, 4608, '400164', 'Divisor 20/2', 2304),
	(417, '402069', '2024-03-01', 2304, 4608, '400164', 'divisor 20/2', 2304),
	(419, '402069', '2024-03-01', 2304, 4608, '400164', 'divisor 20/2', 2004),
	(421, '402069', '2024-03-01', 2304, 4608, '400164', 'divisor  202', 2304),
	(422, '402069', '2024-03-01', 2304, 4608, '400164', 'divisor 20/2', 2304),
	(423, '402069', '2024-03-01', 2304, 4608, '400164', 'divisor 20/2', 2304),
	(424, '402069', '2024-03-01', 2304, 4608, '400164', 'Divisor 20/2', 2304),
	(425, '402069', '2024-03-01', 2304, 4608, '400164', 'Divisor 20/2', 2304),
	(426, '402069', '2024-03-01', 2304, 4608, '400164', 'Divisor 20/2', 2304),
	(427, '402069', '2024-03-01', 2304, 4608, '400164', 'Divisor 20/2', 2304),
	(428, '402069', '2024-03-01', 2304, 4608, '400164', 'Divisor 20/2', 2304),
	(429, '402069', '2024-03-01', 2304, 4608, '400164', 'Divisor 20/2', 2304),
	(430, '402069', '2024-03-02', 2304, 4608, '400164', 'divisor 20/2', 2304),
	(431, '402069', '2024-03-02', 2304, 4608, '400164', 'divisor 20/2', 2304),
	(432, '402069', '2024-03-02', 2304, 4608, '400164', 'divisor 20/2', 2304),
	(433, '402069', '2024-03-02', 2304, 4608, '400164', 'divisor 20/2', 2304),
	(434, '402069', '2024-03-02', 2304, 4608, '400164', 'divisor 20/2', 2304),
	(435, '402069', '2024-03-02', 2304, 4608, '400164', 'divisor 20/2', 2304),
	(436, '402069', '2024-03-02', 2304, 4608, '400164', 'divisor 20/2', 2304),
	(437, '402069', '2024-03-02', 2304, 4608, '400164', 'Divisor 20/2', 2304),
	(438, '402069', '2024-03-02', 2304, 4608, '400164', 'Divisor 20/2', 2304),
	(439, '402069', '2024-03-02', 2304, 4608, '400164', 'Divisor 20/2', 2304),
	(440, '402069', '2024-03-02', 2304, 4608, '400164', 'Divisor 20/2', 2304),
	(441, '402069', '2024-03-02', 2304, 4608, '400164', 'Divisor 20/2', 2304),
	(442, '402069', '2024-03-02', 2304, 4608, '400164', 'Divisor 20/2', 2304),
	(443, '402069', '2024-03-03', 2304, 4608, '400164', 'divisor 20/2', 2304),
	(444, '402069', '2024-03-03', 2304, 4608, '400164', 'divisor 20/2', 2304),
	(445, '402069', '2024-03-03', 2304, 4608, '400164', 'divisor 20/2', 2304),
	(446, '402069', '2024-03-03', 2304, 4608, '400164', 'divisor 20/2', 2304),
	(447, '402069', '2024-03-03', 2304, 4608, '400164', 'divisor 20/2', 2304),
	(448, '402069', '2024-03-03', 2304, 4608, '400164', 'divisor 20/2', 2304),
	(450, '402069', '2024-03-03', 2304, 4608, '400164', 'Divisor20/2', 2304),
	(451, '402069', '2024-03-03', 2304, 4608, '400164', 'Divisor 20/2', 2304),
	(452, '402069', '2024-03-03', 2304, 4608, '400164', 'Divisor 20/2', 2304),
	(453, '402069', '2024-03-03', 2304, 4608, '400164', 'Divisor 20/2', 2304),
	(454, '402069', '2024-03-04', 2304, 4608, '400164', 'divisor 20/2', 2304),
	(455, '402069', '2024-03-04', 0, 0, '400164', 'Divisor 20/2', 300),
	(456, '402069', '2024-03-04', 2304, 4608, '400164', 'divisor 20/2', 2304),
	(457, '402069', '2024-03-04', 2304, 4608, '400164', 'divisor 20/2', 2304),
	(461, '402069', '2024-03-04', 2304, 4608, '400164', 'Divisor 20/2', 2304),
	(462, '402069', '2024-03-04', 2304, 4608, '400164', 'Divisor 20/2', 2304),
	(463, '402069', '2024-03-04', 2304, 4608, '400164', 'Divbisor 20/2', 2304),
	(464, '402069', '2024-03-04', 2304, 4608, '400164', 'Divisor 20/2', 2304),
	(465, '402069', '2024-03-05', 2304, 4608, '400164', 'divisor 20/2', 2304),
	(466, '402069', '2024-03-05', 2304, 4608, '400164', 'divisor 20/2', 2304),
	(467, '402069', '2024-03-05', 2304, 4608, '400164', 'divisor 20/2', 2304),
	(468, '402069', '2024-03-05', 2304, 4608, '400164', 'divisor 20/2', 2304),
	(469, '402069', '2024-03-05', 2304, 4608, '400164', 'Divisor 20/2', 2304),
	(470, '402069', '2024-03-05', 2304, 4608, '400164', 'Divisor 20/2', 2304),
	(471, '402069', '2024-03-05', 2304, 4608, '400164', 'Divisor 20/2', 2304),
	(472, '402069', '2024-03-06', 2304, 4608, '400164', 'divisor 20/2', 2304),
	(473, '402069', '2024-03-06', 2304, 4608, '400164', 'divisor 20/2', 2304),
	(474, '402069', '2024-03-06', 2304, 4608, '400164', 'Divisor 20/2', 2304),
	(475, '402069', '2024-03-07', 2304, 4608, '400164', 'divisor 20/2', 2304),
	(476, '402069', '2024-03-07', 1440, 2880, '400164', 'divisor 20/2', 1440),
	(477, '402069', '2024-03-07', 2282, 4564, '400164', 'Divisor 20/2', 0),
	(478, '402069', '2024-03-07', 0, 0, '400164', 'divisor 20/2', 97),
	(479, '400349', '2024-03-07', 3312, 6624, '400166', 'Divisor 20/4', 3312),
	(480, '400349', '2024-03-07', 3312, 6624, '400166', 'Divisor 20/4', 3312),
	(482, '400349', '2024-03-07', 3312, 6624, '400166', 'Divisor 20/4', 3312),
	(483, '400349', '2024-03-07', 3312, 6624, '400166', 'Divisor 20/4', 3312),
	(484, '400349', '2024-03-07', 3312, 6624, '400166', 'Divisor 20/4', 3312),
	(485, '400349', '2024-03-07', 3312, 6624, '400166', 'Divisor 20/4', 3312),
	(486, '400349', '2024-03-07', 3312, 6624, '400166', 'Divisor 20/4', 3312),
	(487, '400349', '2024-03-07', 3312, 6624, '400166', 'Divisor 20/4', 3312),
	(488, '400349', '2024-03-08', 3312, 6624, '400166', 'Divisor 20/4', 3312),
	(489, '400349', '2024-03-08', 3312, 6624, '400166', 'Divisor 20/4', 3312),
	(490, '400349', '2024-03-08', 3312, 6624, '400166', 'Divisor 20/4', 3312),
	(491, '400349', '2024-03-08', 3312, 6624, '400166', 'Divisor 20/4', 3312),
	(492, '400349', '2024-03-08', 3312, 6624, '400166', 'Divisor 20/4', 3312),
	(493, '400349', '2024-03-08', 3312, 6624, '400166', 'Divisor 20/4', 3312),
	(494, '400349', '2024-03-08', 3312, 6624, '400166', 'Divisor 20/4', 3312),
	(495, '400349', '2024-03-08', 3312, 6624, '400166', 'Divisor 20/4', 3312),
	(496, '400349', '2024-03-08', 3312, 6624, '400166', 'Divisor 20/4', 3312),
	(497, '400349', '2024-03-08', 3312, 6624, '400166', 'Divisor 20/4', 3312),
	(498, '400349', '2024-03-09', 3312, 6624, '400166', 'Divisor 20/4', 3312),
	(499, '400349', '2024-03-09', 3312, 6624, '400166', 'Divisor 20/4', 3312),
	(500, '400349', '2024-03-09', 3312, 6624, '400166', 'Divisor 20/4', 3312),
	(501, '400349', '2024-03-09', 3312, 6624, '400166', 'Divisor 20/4', 3312),
	(502, '400349', '2024-03-09', 3312, 6624, '400166', 'Divisor 20/4', 3312),
	(503, '400349', '2024-03-09', 3312, 6624, '400166', 'Divisor 20/4', 3312),
	(504, '400349', '2024-03-09', 3312, 6624, '400166', 'Divisor 20/4', 3312),
	(505, '400349', '2024-03-09', 3312, 6624, '400166', 'Divisor 20/4', 3312),
	(506, '400349', '2024-03-09', 3312, 6624, '400166', 'Divisor 20/4', 3312),
	(507, '400349', '2024-03-09', 3312, 6624, '400166', 'Divisor 20/4', 3312),
	(508, '400349', '2024-03-09', 3312, 6624, '400166', 'Divisor 20/4', 3312),
	(509, '400349', '2024-03-10', 3312, 6624, '400166', 'Divisor 20/4', 3312),
	(510, '400349', '2024-03-10', 3312, 6624, '400166', 'Divisor 20/4', 3312),
	(511, '400349', '2024-03-10', 3312, 6624, '400166', 'Divisor 20/4', 3312),
	(513, '400349', '2024-03-10', 3312, 6624, '400166', 'Divisor 20/4', 3312),
	(514, '400349', '2024-03-10', 3312, 6624, '400166', 'Divisor 20/4', 3312),
	(515, '400349', '2024-03-10', 3312, 6624, '400166', 'Divisor 20/4', 3312),
	(516, '400349', '2024-03-10', 3312, 6624, '400166', 'Divisor 20/4', 3312),
	(517, '400349', '2024-03-10', 3312, 6624, '400166', 'Divisor 20/4', 3312),
	(518, '400349', '2024-03-10', 3312, 6624, '400166', 'Divisor 20/4', 3312),
	(519, '400349', '2024-03-10', 3312, 6624, '400166', 'Divisor 20/4', 3312),
	(520, '400349', '2024-03-11', 3312, 6624, '400166', 'Divisor 20/4', 3312),
	(521, '400349', '2024-03-11', 3312, 6624, '400166', 'Divisor 20/4', 3312),
	(522, '400349', '2024-03-11', 3312, 6624, '400166', 'Divisor 20/4', 3312),
	(523, '400349', '2024-03-11', 3312, 6624, '400166', 'Divisor 20/4', 3312),
	(524, '400349', '2024-03-11', -3312, -6624, '400166', 'Divisor 20/4', -3312),
	(525, '400349', '2024-03-11', -3312, -6624, '400166', 'Divisor 20/4', -3312),
	(527, '400349', '2024-03-11', 3312, 6624, '400166', 'Divisor 20/4', 3312),
	(528, '400349', '2024-03-11', 3312, 6624, '400166', 'Divisor 20/4', 3312),
	(529, '400349', '2024-03-11', 3312, 6624, '400166', 'Divisor 20/4', 3312),
	(530, '400349', '2024-03-11', 3312, 6624, '400166', 'Divisor 20/4', 3312),
	(531, '400349', '2024-03-11', 3312, 6624, '400166', 'Divisor 20/4', 3312),
	(532, '400349', '2024-03-11', 3312, 6624, '400166', 'Divisor 20/4', 3312),
	(533, '400349', '2024-03-12', 3312, 6624, '400166', 'Divisor 20/4', 3312),
	(534, '400349', '2024-03-12', 3312, 6624, '400166', 'Divisor 20/4', 3312),
	(535, '400349', '2024-03-12', 3312, 6624, '400166', 'Divisor 20/4', 3312),
	(536, '400349', '2024-03-12', 3312, 6624, '400166', 'Divisor 20/4', 3312),
	(537, '400349', '2024-03-12', 3312, 6624, '400166', 'Divisor 20/4', 3312),
	(538, '400349', '2024-03-12', 3312, 6624, '400166', 'Divisor 20/4', 3312),
	(539, '400349', '2024-03-12', 3312, 6624, '400166', 'Divisor 20/4', 3312),
	(540, '400349', '2024-03-12', 3312, 6624, '400166', 'Divisor 20/4', 3312),
	(541, '400349', '2024-03-12', 3312, 6624, '400166', 'Divisor 20/4', 3312),
	(542, '400349', '2024-03-12', 3312, 6624, '400166', 'Divisor 20/4', 3312),
	(543, '400349', '2024-03-12', 3312, 6624, '400166', 'Divisor 20/4', 3312),
	(544, '400349', '2024-03-13', 3312, 6624, '400166', 'Divisor 20/4', 3312),
	(545, '400349', '2024-03-13', 3312, 6624, '400166', 'Divisor 20/4', 3312),
	(546, '400349', '2024-03-13', 3312, 6624, '400166', 'Divisor 20/4', 3312),
	(547, '400349', '2024-03-13', 3312, 6624, '400166', 'Divisor 20/4', 3312),
	(548, '400349', '2024-03-13', 3312, 6624, '400166', 'Divisor 20/4', 3312),
	(549, '400349', '2024-03-13', 3312, 6624, '400166', 'Divisor 20/4', 3312),
	(550, '400349', '2024-03-13', 3312, 6624, '400166', 'Divisor 20/4', 3312),
	(551, '400349', '2024-03-13', 3312, 6624, '400166', 'Divisor 20/4', 3312),
	(552, '400349', '2024-03-13', 3312, 6624, '400166', 'Divisor 20/4', 3312),
	(553, '400349', '2024-03-13', 3312, 6624, '400166', 'Divisor 20/4', 3312),
	(554, '400349', '2024-03-13', 3312, 6624, '400166', 'Divisor 20/4', 3312),
	(555, '400349', '2024-03-14', 3312, 6624, '400166', 'Divisor 20/4', 3312),
	(556, '400349', '2024-03-14', 3312, 6624, '400166', 'Divisor 20/4', 3312),
	(557, '400349', '2024-03-14', 3312, 6624, '400166', 'Divisor 20/4', 3312),
	(558, '400349', '2024-03-14', 3312, 6624, '400166', 'Divisor 20/4', 3312),
	(559, '400349', '2024-03-14', 3312, 6624, '400166', 'Divisor 20/4', 3312),
	(560, '400349', '2024-03-14', 3312, 6624, '400166', 'Divisor 20/4', 3312),
	(561, '400349', '2024-03-14', 3312, 6624, '400166', 'Divisor 20/4', 3312),
	(562, '400349', '2024-03-14', 3312, 6624, '400166', 'Divisor 20/4', 3312),
	(563, '400349', '2024-03-14', 3312, 6624, '400166', 'Divisor 20/4', 3312),
	(564, '400349', '2024-03-14', 3312, 6624, '400166', 'Divisor 20/4', 3312),
	(565, '400349', '2024-03-14', 3312, 6624, '400166', 'Divisor 20/4', 3312),
	(566, '400349', '2024-03-15', 3312, 6624, '400166', 'Divisor 20/4', 3312),
	(567, '400349', '2024-03-15', 3312, 6624, '400166', 'Divisor 20/4', 3312),
	(568, '400349', '2024-03-15', 3312, 6624, '400166', 'Divisor 20/4', 3312),
	(569, '400349', '2024-03-15', 3312, 6624, '400166', 'Divisor 20/4', 3312),
	(570, '400349', '2024-03-15', 3312, 6624, '400166', 'Divisor 20/4', 3312),
	(571, '400349', '2024-03-15', 3312, 6624, '400166', 'Divisor 20/4', 3312),
	(572, '400349', '2024-03-15', 3312, 6624, '400166', 'Divisor 20/4', 3312),
	(573, '400349', '2024-03-15', 3312, 6624, '400166', 'Divisor 20/4', 3312),
	(574, '400349', '2024-03-16', 3312, 6624, '400166', 'Divisor 20/4', 3312),
	(575, '400349', '2024-03-16', 3312, 6624, '400166', 'Divisor 20/4', 3312),
	(576, '400349', '2024-03-15', 3312, 6624, '400166', 'Divisor 20/4', 3312),
	(578, '400349', '2024-03-16', 3312, 6624, '400166', 'Divisor 20/4', 3312),
	(579, '400349', '2024-03-16', 3312, 6624, '400166', 'Divisor 20/4', 3312),
	(580, '400349', '2024-03-16', 3312, 6624, '400166', 'Divisor 20/4', 3312),
	(581, '400349', '2024-03-16', 3312, 6624, '400166', 'Divisor 20/4', 3312),
	(582, '400349', '2024-03-16', 3312, 6624, '400166', 'Divisor 20/4', 3312),
	(583, '400349', '2024-03-16', 3312, 6624, '400166', 'Divisor 20/4', 3312),
	(584, '400349', '2024-03-16', 3312, 6624, '400166', 'Divisor 20/4', 3312),
	(585, '400349', '2024-03-16', 3312, 6624, '400166', 'Divisor 20/4', 3312),
	(586, '400349', '2024-03-17', 3312, 6624, '400166', 'Divisor 20/4', 3312),
	(587, '400349', '2024-03-17', 3312, 6624, '400166', 'Divisor 20/4', 3312),
	(588, '400349', '2024-03-17', 3312, 6624, '400166', 'Divisor 20/4', 3312),
	(589, '400349', '2024-03-17', 3312, 6624, '400166', 'Divisor 20/4', 3312),
	(590, '400349', '2024-03-17', 3312, 6624, '400166', 'Divisor 20/4', 3312),
	(591, '400349', '2024-03-17', 3312, 6624, '400166', 'Divisor 20/4', 3312),
	(592, '400349', '2024-03-17', 3312, 6624, '400166', 'Divisor 20/4', 3312),
	(593, '400349', '2024-03-17', 3312, 6624, '400166', 'Divisor 20/4', 3312),
	(594, '400349', '2024-03-17', 3312, 6624, '400166', 'Divisor 20/4', 3312),
	(595, '400349', '2024-03-17', 3312, 6624, '400166', 'Divisor 20/4', 3312),
	(596, '400349', '2024-03-18', 3312, 6624, '400166', 'Divisor 20/4', 3312),
	(597, '400349', '2024-03-18', 3312, 6624, '400166', 'Divisor 20/4', 3312),
	(598, '400349', '2024-03-18', 3312, 6624, '400166', 'Divisor 20/4', 3312),
	(599, '400349', '2024-03-18', 3312, 6624, '400166', 'Divisor 20/4', 3312),
	(600, '400349', '2024-03-18', 3312, 6624, '400166', 'Divisor 20/4', 3312),
	(601, '400349', '2024-03-18', 3312, 6624, '400166', 'Divisor 20/4', 3312),
	(602, '400349', '2024-03-18', 3312, 6624, '400166', 'Divisor 20/4', 3312),
	(603, '400349', '2024-03-18', 3312, 6624, '400166', 'Divisor 20/4', 3312),
	(604, '400349', '2024-03-25', 3312, 6624, '400166', 'Divisor 20/4', 3312),
	(605, '400349', '2024-03-18', 3312, 6624, '400166', 'Divisor 20/4', 3312),
	(606, '400349', '2024-03-19', 3312, 6624, '400166', 'Divisor 20/4', 3312),
	(607, '400349', '2024-03-19', 3312, 6624, '400166', 'Divisor 20/4', 3312),
	(608, '400349', '2024-03-19', 3312, 6624, '400166', 'Divisor 20/4', 3312),
	(609, '400349', '2024-03-19', 3312, 6624, '400166', 'Divisor 20/4', 3312),
	(610, '400349', '2024-03-19', 3312, 6624, '400166', 'Divisor 20/4', 3312),
	(611, '400349', '2024-03-19', 3312, 6624, '400166', 'Divisor 20/4', 3312),
	(612, '400349', '2024-03-19', 3312, 6624, '400166', 'Divisor 20/4', 3312),
	(613, '400349', '2024-03-19', 3312, 6624, '400166', 'Divisor 20/4', 3312),
	(614, '400349', '2024-03-19', 3312, 6624, '400166', 'Divisor 20/4', 3312),
	(615, '400349', '2024-03-19', 3312, 6624, '400166', 'Divisor 20/4', 3312),
	(616, '400349', '2024-03-20', 414, 828, '400166', 'Divisor 20/4', 414),
	(617, '402069', '2024-03-20', 2304, 4608, '400164', 'divisor 20/2', 2304),
	(618, '402069', '2024-03-20', 2304, 4608, '400164', 'divisor 20/2', 2304),
	(620, '402069', '2024-03-20', 2304, 4608, '400164', 'Divisor 20/2', 2304),
	(621, '402069', '2024-03-20', 2304, 4608, '400164', 'Divisor 20/2', 2304),
	(622, '402069', '2024-03-20', 2304, 4608, '400164', 'Divisor 20/2', 2304),
